,Published_time,news_content
0,2024-02-10 00:53:00,"Không doanh nghiệp nào trên sàn chứng khoán kiếm tiền theo phút bằng chương trình Táo Quân: Petrolimex, Thế Giới Di Động, Vingroup, Hòa Phát, FPT,… cũng phải “chào thua” Những “cỗ máy” kiếm tiền trên sàn chứng khoán như Petrolimex, Thế Giới Di Động, Vingroup, Hòa Phát, FPT,… với quy mô cực khủng, hệ thống khổng lồ cũng không thể so sánh với khả năng kiếm tiền theo phút từ quảng cáo của chương trình Táo Quân."
1,2024-02-09 07:59:00,"Loạt doanh nghiệp trên sàn chứng khoán gói gọn trong chiếc nem ngày Tết Nem rán truyền thống là món ăn quen thuộc trong mâm cơm người Việt, đặc biệt là mâm cơm ngày Tết Nguyên đán. Thật bất ngờ khi món ăn rất đỗi quen thuộc này lại gắn liền với rất nhiều doanh nghiệp đang niêm yết trên thị trường chứng khoán."
2,2024-02-08 21:14:00,"Loạt công ty chứng khoán VNDirect, Vietcap,... bị xử phạt ngay trước khi nghỉ Tết Âm lịch: Có trường hợp tới hàng tỷ đồng Hàng loạt CTCK nhận quyết định xử phạt của UBCKNN trong ngày 6-7/2 tức 27-28 Tết Âm lịch."
3,2024-02-08 16:15:00,"VietinBank tăng tốc, “Big 3” ngân hàng “chễm chệ” trên đỉnh bảng xếp hạng vốn hóa lớn nhất sàn chứng khoán Từ đầu năm 2024, cổ phiếu CTG đã tăng gần 31% thị giá qua đó đẩy vốn hóa VietinBank vượt qua hàng loạt tên tuổi “đình đám” như Hòa Phát, Vingroup, PV Gas và mới nhất là Vinhomes."
4,2024-02-07 19:37:00,"Trung Quốc bơm tiền vào chứng khoán, thị trường khởi sắc Ngày 6/2, thị trường chứng khoán Trung Quốc phục hồi mạnh mẽ sau khi quỹ đầu tư quốc gia Trung Quốc cho biết sẽ tăng cường mua cổ phiếu nhằm ổn định thị trường."
5,2024-02-07 09:02:00,"Thay vì 2 triệu, công ty môi giới chứng khoán chuyển nhầm hơn 29 tỷ đồng cho nhà đầu tư, người này từ chối trả lại, tắt điện thoại rồi ‘ôm tiền’ đi mua nhà, ô tô, ‘tắt’: Cảnh sát vào cuộc Đáng lẽ chỉ chuyển hơn 2 triệu đồng vào tài khoản sử dụng dịch vụ môi giới của khách hàng, Charles Schwab lại chuyển nhầm khoản tiền khủng hơn 29 tỷ, 1/4 số tiền “không cánh mà bay”. Vì vậy, cảnh sát lập tức điều tra và tìm ra sự thật."
6,2024-02-06 08:53:00,"Đối thủ của Vietjet Air, một quý lãi 64 triệu USD, sớm lên sàn chứng khoán Hãng hàng không này vừa công bố sẽ niêm yết trên sàn chứng khoán vào năm sau. Vietjet là đối thủ ""sừng sỏ"" của hãng bay triệu USD."
7,2024-02-05 14:55:00,"Huyền thoại đầu tư Jeremy Grantham: Chứng khoán Mỹ đang đắt đến phi lý, nhà đầu tư nên thận trọng vì bong bóng sẽ vỡ Nhà đầu tư kỳ cựu Jeremy Grantham cho biết chứng khoán Mỹ đang được định giá quá cao, suy thoái kinh tế đang đến gần và AI bị thổi phồng quá mức."
8,2024-02-03 19:57:00,"Chứng khoán Trung Quốc lập kỷ lục buồn, Ấn Độ trái ngược Chứng khoán Trung Quốc vừa trải qua một tuần tồi tệ."
9,2024-02-01 17:25:00,"Một doanh nghiệp trên sàn chứng khoán thưởng Tết vừa độc lạ vừa ""ấm"": Vài người ôm không xuể, chất đầy xe chở về Trong bối cảnh nhiều doanh nghiệp phải đóng cửa hoặc cắt giảm nhân sự, cắt thưởng cuối năm, nợ lương người lao động, việc cán bộ công nhân viên vừa có lương, có thưởng, có quà là điều đáng mừng."
10,2024-02-01 11:35:00,"Nghịch lý nhà giàu: Công ty sở hữu 1,7 tỷ USD ""tiền tươi"", nhiều nhất sàn chứng khoán Việt báo lãi giảm Mỗi ngày, doanh nghiệp này ""bỏ túi"" hơn 5 tỷ đồng lãi tiền gửi ngân hàng."
11,2024-02-01 10:29:00,"Không phải chứng khoán hay bất động sản, đây mới là tài sản được săn đón bậc nhất tại nền kinh tế lớn thứ 2 thế giới Nhu cầu ở quốc gia tiêu thụ vàng số một thế giới không có dấu hiệu giảm nhiệt."
12,2024-02-01 10:23:00,"Người dân Trung Quốc đổ xô mua ròng 280 tấn vàng, ngộ ra bất động sản, chứng khoán không còn là kênh đầu tư tốt Bất chấp nhu cầu vàng toàn cầu đi xuống, sức mua kim loại quý này của người dân Trung Quốc trong năm 2023 đã khiến giá vàng vượt ngưỡng 2.000 USD/ounce."
13,2024-01-31 10:55:00,"Theo đuổi mô hình Zero Fee, công ty chứng khoán tìm nguồn thu từ đâu? Với tệp khách hàng thu hút được nhờ Zero Fee, các công ty chứng khoán có thể triển khai bán chéo thêm nhiều sản phẩm, dịch vụ khác để bù đắp sự thiếu hụt nguồn thu từ môi giới. Một trong những mảng hoạt động đang phát triển mạnh mẽ là cho vay."
14,2024-01-30 11:04:00,"Triển vọng phục hồi kinh tế Trung Quốc vẫn chưa sáng cửa, chứng khoán Hồng Kông trải qua tháng 1 tồi tệ nhất trong gần một thập kỷ Chứng khoán Hồng Kông trượt dốc và trải qua tháng 1 tồi tệ nhất kể từ tháng đầu năm 2016"
15,2024-01-29 13:54:00,"Bán sản vật quý được người dân Trung Quốc không tiếc tiền săn lùng, một doanh nghiệp trên sàn chứng khoán Việt Nam lãi kỷ lục Với khoản lãi 132 tỷ đồng trong năm qua, doanh nghiệp vừa vặn hoàn thành mục tiêu LNTT. Cũng trong năm 2023 công ty dự kiến tỷ lệ chi trả cổ tức bằng tiền xấp xỉ 30%."
16,2024-01-29 09:57:00,"Thị trường chứng khoán miệt mài ""dò đáy"", Trung Quốc đình chỉ cho vay cổ phiếu bị hạn chế, có hiệu lực ngay lập tức Động thái này sẽ “làm nổi bật sự công bằng và hợp lý, giảm hiệu quả cho vay chứng khoán và hạn chế lợi thế của các tổ chức trong việc sử dụng thông tin và công cụ, giúp tất cả các nhà đầu tư có thêm thời gian để tiếp thu thông tin thị trường và tạo ra thị trường công bằng hơn”, Ủy ban Điều tiết Chứng khoán Trung Quốc (CSRC) cho biết."
17,2024-01-27 13:19:00,"Sa thải càng nhiều, cổ phiếu càng tăng: Thành công của Mark Zuckerberg khiến hơn 23.000 lao động mất việc đầu năm 2024 dù chứng khoán công nghệ lên cao nhất 2 năm Việc Meta hay Salesforce tăng trưởng tốt sau khi sa thải hàng loạt đang trở thành bài học khiến ngày càng nhiều doanh nghiệp ở khắp mọi ngành noi theo trong năm 2024."
18,2024-01-26 20:33:00,"80% chứng khoán Mỹ nằm trong tay ‘các cụ’: Rủi ro không ngờ đối với thị trường Kể từ năm 1990, thế hệ người lớn tuổi đã đều đặn tăng cường sở hữu cổ phiếu trong danh mục đầu tư của họ, khác hẳn với trái phiếu và CD."
19,2024-01-26 11:25:00,"Không phải ngân hàng nhưng đem đến gần 80% tài sản đi cho vay lãi suất cao, một công ty trên sàn chứng khoán “vớ bẫm” Ngay cả với các ngân hàng, tỷ lệ cho vay trên tổng tài sản cũng không lớn như công ty này. Vì thế, nguồn thu lớn nhất của công ty cũng đến từ lãi cho vay."
20,2024-01-26 00:10:00,"""Sớm nhất thị trường chứng khoán Việt Nam sẽ được nâng hạng vào tháng 9 năm nay, hỗ trợ VN-Index vượt 1.400 điểm"" Theo Chứng khoán Maybank, trong trường hợp thuận lợi nhất, Việt Nam sẽ được chính thức nâng hạng sớm nhất trong kỳ đánh giá tháng 9/2024 hoặc muộn hơn là tháng 3/2025."
21,2024-01-25 07:21:00,"Cuộc đua “zero fee” bào mòn lợi nhuận mảng môi giới, công ty chứng khoán thu 10 đồng phí lãi không nổi 1 đồng Biên lãi gộp mảng môi giới tại các công ty chứng khoán trong quý 4/2023 đã bị thu hẹp đáng kể xuống dưới 10% từ mức 25,5% trong quý 3 trước đó."
22,2024-01-24 14:45:00,"Doanh nghiệp casino duy nhất trên sàn chứng khoán lỗ 17 quý liên tiếp Mức lỗ này không nhiều như cùng kỳ, nhưng cũng đánh dấu chuỗi 17 quý thua lỗ liên tiếp của doanh nghiệp này, kể từ quý 4/2019."
23,2024-01-24 13:50:00,"Vừa quét camera tải một phần mềm, tài khoản chứng khoán của người đàn ông Hà Nội bị ""bán tháo"", bay sạch 3 tỷ đồng Công an cảnh báo thủ đoạn lừa đảo mới về cuộc gọi thông báo tích hợp mã định danh trên Cổng dịch vụ công."
24,2024-01-24 13:37:00,"Công ty chứng khoán liên quan tới Vạn Thịnh Phát của bà Trương Mỹ Lan báo lỗ đậm nhất ngành năm 2023 Lũy kế cả năm 2023, doanh thu hoạt động chưa tới 1/10 con số năm 2022, đạt 202 tỷ. Theo đó TVSI báo lỗ sau thuế 397 tỷ đồng."
25,2024-01-24 10:12:00,"Nghịch lý thanh khoản 'đi lùi', lượng tiền gửi tại công ty chứng khoán vẫn lên cao nhất 7 quý Trong bối cảnh thanh khoản thị trường liên tục lùi về đáy thì thống kê số dư tiền gửi khách hàng tại các CTCK vào thời điểm cuối năm 2023 đạt khoảng 83.000 tỷ đồng. Con số này đã tăng khoảng 20.000 tỷ đồng so với đầu năm và là mức cao nhất 7 quý qua."
26,2024-01-24 07:46:00,"Xử phạt 12 tổ chức, cá nhân cho ông Đỗ Thành Nhân mượn tài khoản để thao túng chứng khoán 12 tổ chức, cá nhân đã bị xử lý vi phạm pháp luật về chứng khoán và thị trường chứng khoán vì cho ông Đỗ Thành Nhân mượn tài khoản giao dịch dẫn đến thao túng chứng khoán đối với mã chứng khoán BII và TGG."
27,2024-01-23 21:00:00,"83.000 tỷ đồng ""tiền tươi"" gửi tại các công ty chứng khoán Lượng tiền gửi của nhà đầu tư tại các công ty chứng khoán đã tăng 3 quý liên tiếp, đồng thời là mức cao nhất trong vòng 7 quý trở lại đây."
28,2024-01-23 19:05:00,"Thị trường chứng khoán Việt Nam sẽ như nào khi được thăng hạng? Nâng hạng thị trường chứng khoán từ thị trường cận biên lên thị trường mới nổi trước năm 2025 là một trong những mục tiêu lớn mà Chính phủ đang hướng tới. Do đó, năm 2024 kì vọng có những chuyển biến tích cực, bởi đây là năm quan trọng để đảm bảo “tiến độ” nâng hạng của TTCK Việt Nam."
29,2024-01-23 16:08:00,"VNG bất ngờ rút toàn bộ hồ sơ niêm yết tại sàn chứng khoán Mỹ Sau nửa năm kể từ khi nộp hồ sơ theo mẫu F-1 lên SEC, VNG đã xin rút lại toàn bộ hồ sơ."
30,2024-01-23 15:01:00,"Chủ tịch KIM Việt Nam: Tiềm năng phát triển của nền kinh tế và thị trường chứng khoán Việt Nam còn rất lớn Trao đổi trong Talk show Phố Tài Chính (The Finance Street Talk Show) trên VTV8, ông Yun Hang Jin, Chủ tịch HĐTV Công ty Quản lý Quỹ KIM Việt Nam đã có những chia sẻ về triển vọng đầu tư năm 2024."
31,2024-01-23 14:25:00,"Phó Chủ tịch Chứng khoán BSC: Vị thế Việt Nam ngày càng nâng cao, sẽ đón 'làn sóng' đầu tư FDI mới Trao đổi trong Talk show Phố Tài Chính (The Finance Street Talk Show) trên VTV8, ông Chung Jae Hoon, Phó Chủ tịch HĐQT kiêm Phó TGĐ Chứng khoán BSC cho rằng Việt Nam có môi trường đầu tư kinh doanh ổn định, an toàn, hưởng lợi từ làn sóng chuyển dịch sản xuất ra khỏi Trung Quốc."
32,2024-01-23 09:05:00,"Bất ngờ: Doanh thu môi giới chứng khoán sụt giảm trong quý 4, nhưng dư nợ margin toàn thị trường lại tăng mạnh Dư nợ cho vay tăng khoảng 15.000 tỷ trong quý 4/2023 (trong đó margin tăng 13.000 tỷ) nhưng tổng doanh thu môi giới của các công ty chứng khoán lại giảm 21% so với quý 3."
33,2024-01-23 06:48:00,"Chuyện lạ: Một khách sạn trên sàn chứng khoán ""lỡ"" tiêu hết 500 tỷ tiền chào bán riêng lẻ, hơn năm sau mới thông qua thay đổi phương án sử dụng vốn Ngay khi vừa kết thúc đợt chào bán riêng lẻ cổ phiếu, DAH đã sử dụng hết số tiền thu về song hơn một năm sau đó lại thông qua Nghị quyết thay đổi phương án sử dụng."
34,2024-01-22 13:45:00,"""Tiền ngoại"" khiến thị trường chứng khoán từng bị mô tả là “ngủ quên” này tiếp tục thăng hoa trong năm mới Các nhà đầu tư toàn cầu, bao gồm nhiều nhà đầu tư Trung Quốc, đang tiếp tục đổ tiền vào TTCK Nhật Bản trong bối cảnh đồng yên yếu hơn còn Ngân hàng Trung ương Nhật Bản (BOJ) đang thúc đẩy chấm dứt chính sách lãi suất âm."
35,2024-01-22 10:22:00,"Không chỉ ngân hàng, một loạt doanh nghiệp bất động sản, chứng khoán, cảng biển... cũng nô nức báo lãi vượt đỉnh Dù mùa báo cáo tài chính quý 4/2023 vừa mới bắt đầu, đã có nhiều doanh nghiệp công bố mức lợi nhuận cả năm lớn chưa từng có."
36,2024-01-22 09:45:00,"Giáo sư kinh tế kỳ cựu Steve Hanke: Kinh tế suy thoái, chứng khoán giảm, lạm phát hạ nhiệt dưới 2% cuối năm nay Nhà kinh tế cho biết, cổ phiếu đang giao dịch ở mức định giá cao và sẽ giảm khi suy thoái bắt đầu."
37,2024-01-22 09:35:00,"Một công ty chứng khoán báo lãi tăng đột biến, gấp 116 lần cùng kỳ Tuy nhiên, trong quý cuối năm 2023, thị phần môi giới cổ phiếu, chứng chỉ quỹ và chứng quyền có đảm bảo của công ty trên HoSE đã bị thu hẹp xuống mức 6,64%."
38,2024-01-22 07:50:00,"83.000 tỷ đồng “tiền tươi” nằm chờ trên tài khoản của nhà đầu tư tại các công ty chứng khoán vào cuối quý 4, cao nhất trong gần hai năm Hầu hết các CTCK đều ghi nhận số dư tiền gửi khách hàng gia tăng, tuy nhiên công ty có số dư lớn nhất bất ngờ giảm gần 3.100 tỷ ""tiền tươi"" của nhà đầu tư chỉ trong vòng ba tháng cuối năm."
39,2024-01-21 12:34:00,"""Thần chứng khoán"" Warren Buffett: Sau 30 tuổi hãy làm 3 VIỆC để sống đời ngoại hạng! Trong tất cả các tỷ phú thế giới, có thể nói Warren Buffett là người nổi bật với cách kiếm tiền và tư duy độc đáo, đáng để chúng ta học hỏi."
40,2024-01-20 19:25:00,"Cho khách đặt lệnh khi không đủ tiền, công ty chứng khoán bị phạt trăm triệu Ủy ban Chứng khoán Nhà nước xác định, Chứng khoán Việt Tín cho một số khách hàng thực hiện lệnh mua chứng khoán khi không đủ tiền trong tài khoản."
41,2024-01-19 11:06:00,"Chuyên gia dự báo kênh đầu tư 2024: Vàng có thể lên 85 triệu đồng/lượng, chứng khoán tăng 30%, bất động sản khó bứt phá Theo chuyên gia, chứng khoán là kênh đầu tư có kỳ vọng biên độ lợi nhuận lên tới 30%/năm. Trong khi đó, giá vàng dao động quanh vùng hiện nay và tối đa chạm mốc 85 triệu đồng/lượng."
42,2024-01-18 09:41:00,"Công ty trên sàn chứng khoán làm dự án chế biến tre 3.000 tỷ được đích thân Thủ tướng thúc đẩy tại Davos Thủ tướng Chính phủ Phạm Minh Chính đề nghị hai bên hợp tác chặt chẽ để triển khai dự án có hiệu quả và thành công tại Việt Nam, góp phần nâng cao giá trị, xuất khẩu sản phẩm tre Việt Nam, nhất là sang các nước Trung Đông."
43,2024-01-18 07:00:00,"Những pha ""khó đỡ"" trên sàn chứng khoán 2023: Hapaco lập “giới tinh hoa” để vay tiền cổ đông, CII năn nỉ cổ đông đi họp và những cơn ""say giá"" Năm 2023, thị trường chứng khoán Việt chứng kiến biến cố chưa từng có, đồng thời xếp hạng thứ 2 thế giới về mức độ giảm điểm. Trong “cơn bĩ cực” ấy, nhiều câu chuyện “độc lạ” được ra đời."
44,2024-01-17 09:33:00,"Nhật Bản trỗi dậy sau 30 năm ngủ quên: Thị trường chứng khoán như 'lên đồng', nghề môi giới thành 'hàng nóng' với mức lương 205.000 USD Những nhà môi giới chứng khoán lâu năm ở Nhật Bản được đề nghị mức lương đến 205.000 USD/năm nhưng chưa chắc đã tuyển nổi. Thị trường được đánh giá là đang sôi động hơn bao giờ hết."
45,2024-01-16 19:30:00,"Triển vọng đầu tư 2024: Cổ phiếu chứng khoán tiềm năng ""dậy sóng"" Năm 2024, lợi nhuận của các doanh nghiệp niêm yết Việt Nam được kỳ vọng tăng trưởng khoảng 19%, cao nhất trong ASEAN và cao hơn cả Trung Quốc, Ấn Độ. Thị trường chứng khoán tăng trưởng là cơ hội để đầu tư, nhất là với cổ phiếu của công ty chứng khoán công nghệ có tiềm năng, có sự khác biệt…"
46,2024-01-16 14:26:00,"Công ty chứng khoán Hàn Quốc đầu tiên báo lỗ trong quý 4/2023, doanh thu môi giới vỏn vẹn 100 triệu đồng Mặc dù tung ra nhiều chương trình ưu đãi giai đoạn cuối năm 2023 song hoạt động kinh doanh của công ty chưa thực sự khả quan, các mảng kinh doanh đem về doanh thu thấp, thậm chí lỗ ròng."
47,2024-01-16 08:35:00,"Ngoài chứng khoán, bất động sản,...nhiều người trên thế giới đang đầu tư vào một ‘tài sản độc đáo’, dù ‘cũ’ bán lại vẫn thu lợi nhuận cao: Chú ý vài bí quyết là không bỏ lỡ cơ hội Những món đồ “đã qua sử dụng” này lại được ưa chuộng hơn bao giờ hết khiến giá trị của chúng ngày một tăng cao."
48,2024-01-15 19:07:00,"Tiền đổ vào chứng khoán bất ngờ giảm mạnh Trên sàn HoSE, giá trị giao dịch hôm nay (15/1) chỉ đạt hơn 11.500 tỷ đồng, thấp hơn gần 50% so với phiên cuối tuần trước."
49,2024-01-14 13:45:00,"Con trai út của nhà đầu tư chứng khoán Warren Buffett: Được cha dạy 4 ĐIỀU quý báu, giúp đường đời rộng mở Đây đều là những nguyên tắc giáo dục được áp dụng trong gia đình tỷ phú Warren Buffett."
50,2024-01-13 20:37:00,"Ủy ban chứng khoán xử phạt 4 doanh nghiệp Ủy ban Chứng khoán Nhà nước vừa công bố quyết định xử phạt 4 doanh nghiệp, tổng số tiền hơn 1 tỷ đồng. Trong đó, CTCP Chứng khoán Đại Việt bị phạt số tiền lớn nhất, 435 triệu đồng."
51,2024-01-13 16:30:00,Chứng khoán dự báo tiếp tục giằng co VNDirect dự toán xu hướng giằng co của thị trường chứng khoán có thể tiếp tục khi dòng tiền chưa có sự đồng thuận và lan tỏa giữa các nhóm ngành.
52,2024-01-13 10:00:00,"Quỹ ngoại PYN Elite Fund sẽ góp 12% vốn vào Chứng khoán DNSE Vừa qua, Quỹ PYN Elite Fund và Công ty CP Chứng khoán DNSE đã chính thức ký kết thỏa thuận hợp tác. Theo đó, Quỹ ngoại đến từ Phần Lan sẽ nắm giữ 12% vốn và trở thành cổ đông lớn thứ hai của DNSE."
53,2024-01-13 08:52:00,"Chứng khoán Nhật Bản đòi lại ngôi vị số 1 Châu Á từ Trung Quốc, khiến Warren Buffett cũng không thể cưỡng lại sức hút Sàn chứng khoán Tokyo đã đòi lại ngôi vị số 1 Châu Á của mình từ tay Thượng Hải, trong bối cảnh lãi suất âm, đồng Yên yếu khiến đến Warren Buffett cũng không cưỡng lại được."
54,2024-01-12 06:50:00,"Cổ phiếu Bóng đèn Phích nước Rạng Đông lầm lũi lên đỉnh gần 2 năm, EPS top đầu sàn chứng khoán, đều đặn chia cổ tức tiền mặt Thị giá RAL đã âm thầm tăng hơn 58%, qua đó lên mức giá cao nhất kể từ tháng 5/2022."
55,2024-01-11 16:32:00,"Chán nản vì thua lỗ, nhà đầu tư Trung Quốc đổ xô sang nước láng giềng khi thấy chứng khoán tăng ‘như diều gặp gió’ Một số chuyên gia cho rằng làn sóng di cư của các nhà đầu tư sẽ còn tiếp diễn trong năm 2024."
56,2024-01-11 10:13:00,"Nguy cơ mắc kẹt với khoản đầu tư nghìn tỷ đồng trái phiếu của Chứng khoán Everest Trong bối cảnh tình hình kinh tế khó khăn, các tổ chức phát hành trái phiếu doanh nghiệp xin giãn kỳ hạn, giảm lãi suất các lô trái phiếu mà Chứng khoán Everest đang nắm giữ ..."
57,2024-01-10 10:30:00,"Đầu tư túi hiệu sinh lời không kém chứng khoán, nhà đất: Phải có kiến thức nếu không dễ “mất trắng"" Túi xách hàng hiệu được đánh giá là món đầu tư sinh lời tốt. Thế nhưng, có phải ai cũng phù hợp với “bộ môn"" này?"
58,2024-01-09 14:08:00,"Chủ tịch UBCKNN đưa 6 giải pháp để thị trường chứng khoán ngày càng trở thành kênh huy động vốn trung và dài hạn hiệu quả Trong Talk Show Phố Tài Chính, bà Vũ Thị Chân Phương, Chủ tịch UBCKNN cho biết, Ủy ban Chứng khoán Nhà nước sẽ tiếp tục thực hiện tốt công tác triển khai các giải pháp đã được quy định trong đề án Chiến lược phát triển thị trường chứng khoán Việt Nam đến năm 2030, đồng thời thực hiện thêm một loạt giải pháp cụ thể khác để đảm bảo thị trường hoạt động ổn định, công bằng, công khai và phát triển bền vững."
59,2024-01-09 08:30:00,"Kênh đầu tư mới đang khiến giới tài phiệt Gen Z mê mệt, thu lời không kém bất động sản hay chứng khoán Kênh đầu tư này ngày càng bùng nổ giữa thời điểm nền kinh tế toàn cầu suy thoái."
60,2024-01-08 09:54:00,"Cổ phiếu ""sừng sỏ"" ngành chứng khoán có thể bị loại khỏi rổ VNFinLead ngay trong tháng 1 BSC Research dự phóng sẽ không có cổ phiếu nào được thêm mới vào bộ chỉ số VN-Finlead Index, trong khi đó cố phiếu HCM của Chứng khoán Thành phố Hồ Chí Minh (HSC) có khả năng sẽ phải rời rổ."
61,2024-01-06 19:36:00,"Tài khoản chứng khoán mở mới sụt giảm mạnh sau 2 năm bùng nổ Sau thời kỳ bùng nổ 2021, 2022, ghi nhận hơn 4,1 triệu tài khoản mở mới qua 2 năm, tới 2023 số lượng này giảm mạnh. Cả năm qua, nhà đầu tư trong nước mở thêm 385.700 tài khoản chứng khoán."
62,2024-01-06 11:22:00,"Bộ Tài chính: Đã thanh lọc hàng loạt công ty chứng khoán yếu kém, kết nối dữ liệu nhà đầu tư với cơ sở dữ liệu công dân Thứ trưởng Bộ Tài chính kỳ vọng những giải pháp cụ thể của cơ quan quản lý và niềm tin nhà đầu tư trở lại sẽ giúp thị trường giữ được và có sự tăng trưởng bền vững và thực chất."
63,2024-01-06 09:07:00,"10 sự kiện nổi bật ngành chứng khoán năm 2023 Ngành Chứng khoán kết thúc năm 2023 với nhiều sự kiện nổi bật như Ra mắt hệ thống giao dịch trái phiếu doanh nghiệp riêng lẻ, Thủ tướng chỉ đạo quyết liệt triển khai các giải pháp nâng hạng thị trường…."
64,2024-01-05 19:56:00,"Sát ngày cuối năm, một doanh nghiệp phân bón trên sàn chứng khoán chia 5 kế hoạch lợi nhuận 2023 để kịp về đích So với kế hoạch ban đầu, doanh nghiệp mới thực hiện 26% chỉ tiêu lợi nhuận sau thuế. Nhưng theo kế hoạch mới được thông qua vào phút chót, doanh nghiệp đã hoàn thành vượt 24% chỉ tiêu lợi nhuận cả năm 2023 sau 9 tháng."
65,2024-01-04 21:54:00,Một DN xăng dầu niêm yết trên sàn chứng khoán bị cưỡng chế gần 1.300 tỷ đồng tiền thuế Doanh nghiệp xăng dầu này bị tỉnh Hậu Giang cưỡng chế 1.159 tỷ đồng và bị Cần Thơ cưỡng chế hơn 92 tỷ đồng.
66,2024-01-04 20:48:00,"Dòng tiền tỷ USD bất ngờ đổ vào thị trường chứng khoán Áp lực chốt lời dù có phần gia tăng vào cuối phiên giao dịch hôm nay (4/1), nhưng với sự hỗ trợ của nhóm cổ phiếu ngân hàng, VN-Index vẫn có phiên tăng điểm tích cực. Đáng chú ý, thanh khoản thị trường bất ngờ đạt mức 1,2 tỷ USD trong bối cảnh thị trường giao dịch lình xình cả tháng."
67,2024-01-04 10:47:00,Tác động từ biên bản cuộc họp tháng 12 của FED lan sang thị trường châu Á: Chứng khoán Nhật Bản giảm sâu nhất trước biến cố dồn dập Thị trường chứng khoán châu Á nói chung cũng chịu tác động giống như thị trường toàn cầu sau khi biên bản cuộc họp tháng 12 của Cục Dự trữ Liên bang Mỹ (FED) được công bố.
