,Published_time,news_content
627,2023-02-22 10:39:00,"Một công ty chứng khoán có vốn điều lệ nghìn tỷ sắp lên sàn Tại thời điểm 31/12/2022, cơ cấu cổ đông của Chứng khoán An Bình ghi nhận Tập đoàn Geleximco – CTCP nắm gần 464 triệu cổ phần, tỷ lệ sở hữu 45,86%."
628,2023-02-21 09:05:00,"Không phải chứng khoán hay BĐS, đây mới là “con gà đẻ trứng vàng"" được các ngôi sao rót tiền: Donald Trump hay Lionel Messi thu lợi lớn nhờ đầu tư vào đây Ngoài công việc chính, nhiều người nổi tiếng cũng đầu tư vào ""nghề tay trái"" để nhân tài sản lên nhiều lần."
629,2023-02-20 20:40:00,"Bất động sản, chứng khoán đã được chiết khấu đủ sâu và hấp dẫn? Lãi suất tiết kiệm đang hạ nhiệt, bất động sản xuất hiện những đợt chiết khấu 40-50%, VN-Index từ 1.500 xuống còn dưới 1.100 điểm...dòng tiền sẽ tìm tới đâu trong thời gian tới?"
630,2023-02-20 13:28:00,"Trí Việt (TVC) họp ĐHĐCĐ bất thường, miễn nhiệm thành viên bị bắt vì tội thao túng chứng khoán Cũng tại đại hội lần này, HĐQT Trí Việt cũng dự kiến trình cổ đông thông qua bầu bổ sung thay thế 1 thành viên HĐQT nhiệm kỳ 2023-2028."
631,2023-02-19 12:40:00,"Học lỏm mẹo đầu tư ở sân golf, chàng caddie đổi đời nhờ chứng khoán: Tài sản tăng gấp 700 lần mà không cần tiết kiệm một đồng Những kinh nghiệm đầu tư học hỏi trên sân golf trong những năm tháng tuổi trẻ đã giúp Peter Lynch trở thành huyền thoại trong giới đầu tư."
632,2023-02-19 10:51:00,"4 triết lý đầu tư của 'thần đồng chứng khoán' phố Wall: Chọn cổ phiếu giống như chăn cừu, lợi nhuận lớn, thua lỗ nhỏ nhờ ‘tiến 3 lùi 1’ Người đàn ông này bước vào ngành chứng khoán Mỹ khi chỉ có 27 USD trong túi, và trở thành huyền thoại Trung Quốc ở phố Wall chỉ sau 3 năm."
633,2023-02-19 08:50:00,"Không đầu tư chứng khoán hay bất động sản, freelancer 27 tuổi kiếm gần 2,5 tỷ đồng/năm: Thảnh thơi làm việc 4 tiếng/ngày, có gì khó chỉ cần hỏi ChatGPT Tony Dong là một người viết nội dung tự do, anh cho biết mình thường xuyên sử dụng ChatGPT để lên dàn ý cho những gì mình chuẩn bị sản xuất và thảnh thơi vừa làm vừa đi chơi với thu nhập gần 2,5 tỷ đồng/năm."
634,2023-02-17 19:15:00,"Giao dịch cổ phiếu ACB, một công ty chứng khoán bị xử phạt Ngày 21/6/2022, TVS mua vào 5.000 cổ phiếu ACB nhưng không báo cáo và công bố thông tin về việc dự kiến giao dịch."
635,2023-02-15 09:40:00,"Huyền thoại chứng khoán Nhật Bản tiết lộ 3 ""tuyệt chiêu"" để đầu tư thắng lớn, 82 tuổi kiếm trăm triệu đô la, tạo nên kỳ tích chưa từng có Ông Ginzo Korekawa là người tạo nên huyền thoại trên thị trường chứng khoán nhờ dự đoán chính xác thị trường chứng khoán, thu hoạch chiến lợi phẩm lớn nhất trong đời ở tuổi 82."
636,2023-02-15 08:23:00,"Bứt phá ngoạn mục, Chứng khoán Lào tăng vượt VN-Index Đóng cửa phiên giao dịch 14/2, chỉ số VN-Index dừng tại 1.038,64 điểm, trong khi LSE Composite Index của Lào tăng 42,78 điểm, lên mức 1.072,97, cao nhất trong vòng 5 năm."
637,2023-02-14 19:56:00,"Mỗi tuần mua 2, 3 lần Vietlott trong suốt 2 năm để tìm vận may, người đàn ông trúng 92,5 tỷ đồng khẳng định: ""Nếu đầu tư thì mua đất chứ không dám mua chứng khoán"" ""Mọi người thường nghi ngờ không biết Vietlott có trao giải thật không. Tôi muốn nói là mọi người nên suy nghĩ lại vì đây là sự thật"" - ông H. nói khi nhận hơn 83 tỷ vào tài khoản."
638,2023-02-14 11:33:00,"Sau một năm thăng hoa nhờ Covid, doanh nghiệp sản xuất bao cao su duy nhất trên sàn chứng khoán rơi mất 30% doanh thu, lãi giảm một nửa Trước đó năm 2021, Merufa đạt doanh thu cao nhất trong lịch sử, lên đến 285 tỷ đồng (tương đương khoảng 12,5 triệu USD)."
639,2023-02-13 10:51:00,"'Cao thủ chứng khoán' Nhật Bản: Lãi đậm 17 triệu USD sau 1 giao dịch, nhân tài khoản lên 11.000 lần sau 8 năm đầu tư Từ một tài khoản nhỏ với chỉ khoảng 13.600 USD, Takashi Kotegawa đã hô biến nó thành 153 triệu USD chỉ trong vòng 8 năm."
640,2023-02-11 14:00:00,Chứng khoán Bản Việt nói gì trước thông tin về giao dịch cổ phiếu Eximbank? Đại diện công ty chứng khoán này cũng cho biết đang phối hợp chặt chẽ với các cơ quan chức năng để có biện pháp xử lý đối với các đối tượng trên nhằm bảo vệ quyền và lợi ích hợp pháp của VCI theo quy định của pháp luật.
641,2023-02-11 08:44:00,"Hàng chục nghìn tỷ ở tài khoản chứng khoán chờ đầu tư Giai đoạn khó khăn nhất của chứng khoán Việt Nam được dự báo đã qua, thị trường đang hiện dần những cơ hội đầu tư mới. Hàng chục nghìn tỷ đồng nằm sẵn trong tài khoản nhà đầu tư, chờ giải ngân."
642,2023-02-11 08:40:00,"Chứng khoán ACB lên tiếng trước tin đồn về giao dịch cổ phiếu Eximbank “Bằng văn bản này, công ty TNHH Chứng khoán ACB (ACBS) khẳng định không tham gia vào bất cứ giao dịch hoặc có hành vi vi phạm pháp luật liên quan đến giao dịch mã chứng khoán EIB“."
643,2023-02-10 19:31:00,"Thành viên HĐQT và ban kiểm soát Chứng khoán VIX xin từ nhiệm Ngày 10/2/2023, Công ty Cổ phần Chứng khoán VIX vừa có thông báo việc từ nhiệm của các vị trí nhân sự cấp cao."
644,2023-02-10 15:31:00,"Cổ phiếu liên tục ‘tăng trần’, VNG phải giải trình với Ủy ban Chứng khoán và HNX VNG cho rằng hoạt động kinh doanh của công ty vẫn diễn ra bình thường, không có bất kỳ biến động nào từ việc tăng giá cổ phiếu."
645,2023-02-10 15:12:00,"Cổ phiếu VNZ đắt nhất lịch sử chứng khoán Việt Nam, VNG cán mốc vốn hóa tỷ USD Vốn hóa thị trường của VNG đã đạt mức 24.000 tỷ đồng, tương đương hơn 1 tỷ USD, gấp gần 4 lần thời điểm chào sàn"
646,2023-02-08 19:00:00,"Từ 1000 cổ phiếu mà chồng để lại, cụ bà 75 tuổi đầu tư chứng khoán rồi kiếm 50 tỷ đồng trong 8 năm: ""Kỹ xảo"" hốt tiền là ""mua ở đầu gối và bán ra ở vai"" Bị chồng chê không biết kiếm tiền, cụ bà người Đức 75 tuổi quyết định tham gia đầu tư chứng khoán rồi bất ngờ kiếm được tiền khủng nhờ tư duy đầu tư khôn ngoan."
647,2023-02-08 08:29:00,"10 người giàu nhất sàn chứng khoán 2022: Ông Vượng qua Mỹ cắm cờ, ông Long chìm nổi, bơ phờ ông Nhơn Sau 1 năm thị trường chứng khoán trải qua nhiều biến động mạnh, tài sản của 10 doanh nhân giàu nhất Việt Nam cũng ghi nhận sự thay đổi lớn, giảm hơn 260.000 tỷ đồng."
648,2023-02-07 17:00:00,"Điều gì khiến các quỹ ETF ồ ạt tham gia thị trường chứng khoán Việt Nam? Theo ông Ngô Thanh Hải, Chủ tịch FPT Capital, việc các quỹ ETF liên tục mua ròng trong thời gian qua cho thấy thị trường chứng khoán Việt Nam hiện đang tương đối hấp dẫn và về dài hạn của kinh tế Việt Nam và thị trường tài chính Việt Nam có rất nhiều triển vọng."
649,2023-02-07 15:00:00,"Công ty có nhiều cổ đông nhất sàn chứng khoán sắp họp ĐHCĐ thường niên tại khách sạn 5 sao, ""ngang ngửa"" dân số một quận ở Hà Nội Hòa Phát sẽ chốt danh sách cổ đông vào ngày 27/2 và tổ chức họp vào ngày 30/3."
650,2023-02-07 08:49:00,"Chủ tịch Ngân hàng VDB làm Phó Chủ tịch Ủy ban Chứng khoán Nhà nước Ủy ban Chứng khoán Nhà nước vừa có tân Phó Chủ tịch 48 tuổi là ông Lương Hải Sinh, Chủ tịch Hội đồng quản trị Ngân hàng Phát triển Việt Nam (VDB)"
651,2023-02-07 07:41:00,"Đi qua ""mùa hoa đẹp nhất"", tương lai nào cho nghề môi giới chứng khoán? Tại Việt Nam, đã xuất hiện những công ty chứng khoán đi theo xu hướng miễn phí giao dịch. Điều này ảnh hưởng trực tiếp đến nghề môi giới, những người đang phụ thuộc lớn vào phí giao dịch của khách hàng."
652,2023-02-06 16:11:00,"Một năm đầu tư chứng khoán, thợ sửa chữa đồ điện tử có thể nhân tài sản lên 4 lần: Muốn lãi nhiều hơn lỗ ở trong ""mắt bão"" chỉ cần một từ Với hơn 170 triệu đồng, chỉ sau một năm người đàn ông này đã nhân 4 lần tài sản của mình bằng cách tham gia vào thị trường chứng khoán. Mất 4 năm để có được số vốn ban đầu nhưng chỉ cần một năm sau đó, ông đã nhận về số tiền lên đến 692 triệu đồng."
653,2023-02-06 15:48:00,"Hé lộ về sàn chứng khoán bí ẩn: Giá trị lớn gấp 5 lần trong chưa đầy 4 năm, được thúc đẩy bởi 1 công ty duy nhất với cổ phiếu tăng 42.000% Sàn giao dịch Abu Dhabi vốn không có mấy tiếng tăm ở vùng Vịnh, song vốn hoá lại đạt hơn 650 tỷ USD nhờ 1 cổ phiếu ít ai biết tăng 42.000%."
654,2023-02-06 15:05:00,"VNZ thành cổ phiếu đắt nhất sàn chứng khoán khi tăng hơn gấp đôi sau 4 phiên, vậy thu nhập nhân viên ở VNG biến động ra sao trong năm 2022? Vốn được coi là ""kỳ lân"" trong làng công nghệ, mức thu nhập của nhân viên VNG có đáng mơ ước?"
655,2023-02-06 10:35:00,"""Game"" hay của VNG trên sàn chứng khoán: Chỉ với hơn 110 triệu đồng, cổ phiếu lập đỉnh mới, ""bang chủ"" Lê Hồng Minh có thêm 720 tỷ đồng Đó là câu chuyện vô tiền khoáng hậu của ông Lê Hồng Minh, CEO Công ty cổ phần VNG (mã cổ phiếu: VNZ) đang được nhắc đến nhiều trong những ngày qua."
656,2023-02-05 15:40:00,"Vì sao nhiều ngân hàng, kể cả Vietcombank, đều lỗ nặng từ đầu tư, kinh doanh chứng khoán? Theo báo cáo tài chính, hàng loạt ngân hàng ghi nhận kết quả hoạt động mua bán chứng khoán trong năm 2022 kém hơn nhiều so với năm trước đó, thậm chí là lỗ đậm hàng trăm tỷ đồng."
657,2023-02-04 15:55:00,"Từng có lúc tài khoản lãi cả triệu USD, 'đội quân' nhà đầu tư nghiệp dư sốc vì trắng tay sau 2 năm, vội đến rồi vội đi khỏi thị trường chứng khoán Các hộ gia đình dự kiến sẽ rút khoảng 100 tỷ USD khỏi thị trường vào năm 2023, đây sẽ là lần đầu tiên dòng tiền chảy ra khỏi thị trường kể từ năm 2018."
658,2023-02-03 20:45:00,"Lộ diện quán quân EPS trên sàn chứng khoán, đạt gần 54.000 đồng Bibica báo lãi kỷ lục 189 tỷ đồng - cao gấp hơn 8 lần cùng kỳ và hiện giữ luôn ngôi vương EPS của năm."
659,2023-02-03 14:10:00,"68 năm đầu tư chứng khoán chưa một lần lỗ, lão làng hơn 100 tuổi trải qua 26 lần thị trường chao đảo tiết lộ: Đừng mong kiếm được 101% số tiền, 66% đã là quá đủ Sống sót sau sự sụp đổ của thị trường chứng khoán Mỹ năm 1929, vị lão làng này không bị ảnh hưởng gì. Trải qua 68 năm đầu tư, ông chưa một lần chịu cảnh lỗ bất chấp thị trường có biến cố."
660,2023-02-02 16:34:00,"Người môi giới chứng khoán 23 tuổi kiếm 117 tỷ đồng sau 18 tháng vào nghề: Chiến lược nằm ở 1 vật nhỏ bằng đốt ngón tay, nghề nào cũng có thể áp dụng Nhiều người tin rằng sự nhất quán, kiên trì có thể tạo nên thành công nhưng không phải ai cũng biết phương pháp duy trì nó trong khoảng thời gian dài."
661,2023-02-02 11:12:00,"Bộ đôi quỹ ETF ngoại lâu đời nhất thị trường chứng khoán Việt Nam hút ròng gần 3.000 tỷ đồng trong tháng đầu năm 2023 Chỉ trong tháng 1, hai quỹ ETF ngoại hàng đầu thị trường đã hút ròng tổng cộng gần 115 triệu USD (khoảng gần 2.700 tỷ đồng). Trong đó, tỷ trọng phân bổ vào cổ phiếu Việt Nam ước tính khoảng 2.200 tỷ đồng."
662,2023-02-02 10:37:00,"Lãi to trong quý 4/2022, Vietravel có thể 'lách qua khe cửa hẹp' để thoát cảnh hạn chế giao dịch trên sàn chứng khoán Báo cáo tài chính hợp nhất quý IV/2022 ghi nhận lãi trước thuế của Vietravel đạt 229,3 tỷ đồng, doanh thu 1.128,8 tỷ đồng. Kết thúc năm 2022, Vietravel đạt doanh thu 3.809 tỷ đồng và lợi nhuận trước thuế 121,8 tỷ đồng. Với kết quả này, sắp tới, cổ phiếu VTR nhiều khả năng không còn bị hạn chế giao dịch trên sàn giao dịch chứng khoán nữa."
663,2023-02-02 09:27:00,"Đem tiền đầu tư chứng khoán, loạt doanh nghiệp “tay ngang” ngậm ngùi ôm lỗ, “tay chơi” mới còn vào ngay đỉnh Thị trường chứng khoán có những đặc thù riêng với nhiều biến động mạnh và khó lường. Do đó, kiếm lời từ kênh đầu tư này chưa bao giờ là dễ dàng, đặc biệt với các doanh nghiệp “tay ngang”."
664,2023-02-01 17:14:00,"Loạt cổ phiếu nằm sàn, chứng khoán giảm mạnh nhất từ đầu năm Sau khi lình xình đi ngang suốt phiên sáng nay (1/2), qua giờ nghỉ trưa, VN-Index bắt đầu tuột dốc. Thanh khoản tăng nhanh, áp lực bán dâng cao, chỉ trong phiên ATC, giá trị khớp lệnh HoSE tăng gần 1.500 tỷ đồng."
665,2023-02-01 10:16:00,"Thị trường không thuận lợi, Dragon Capital Việt Nam vẫn lãi kỷ lục, thu gần nghìn tỷ từ tư vấn đầu tư chứng khoán Cả năm 2022, Dragon Capital Việt Nam ghi nhận mức lợi nhuận sau thuế tăng 1,8 lần so với thực hiện năm trước lên mức 442 tỷ đồng."
666,2023-02-01 09:14:00,"Kinh doanh khả quan từ bảo hiểm đến chứng khoán, Bảo Việt đạt doanh thu hơn 54 nghìn tỷ đồng, tổng tài sản hơn 8 tỷ USD Tổng doanh thu hợp nhất của Bảo Việt năm 2022 đạt 54,5 nghìn tỷ đồng. Trong đó, mảng kinh doanh bảo hiểm nhân thọ đóng góp lớn nhất với doanh thu 41,7 nghìn tỷ đồng, tăng trưởng 10,1% so với cùng kỳ."
667,2023-01-31 15:40:00,"Huyền thoại chứng khoán tiết lộ 'kỹ xảo' tăng tài sản lên 700 lần chỉ trong 13 năm: Hơn thua nằm ở 3 câu hỏi ngắn ít người áp dụng trước khi đặt lệnh mua hay bán Được tạp chí Times đánh giá là người quản lý quỹ giỏi nhất thế giới, để có thể biến 18 triệu USD thành 14 tỷ USD, người đàn ông này thường áp dụng 3 triết lý này trước khi đặt lệnh mua."
668,2023-01-30 20:56:00,"Ngỡ ngàng: Một doanh nghiệp trên sàn chứng khoán bất ngờ thành lập “Giới tinh hoa” để vay vốn Tạm tính theo mức thị giá cổ phiếu HAP hiện tại, một cổ đông bên ngoài sẽ phải có tối thiểu 20,4 tỷ đồng để lọt vào “Giới tinh hoa của Hapaco”. Con số này đối với cổ đông đang làm việc tại tập đoàn là khoảng 23,4 tỷ đồng."
669,2023-01-30 17:14:00,"Doanh nghiệp kinh doanh dây thừng duy nhất trên sàn chứng khoán báo lãi thấp kỷ lục từ khi niêm yết Lợi nhuận sau thuế Siam Brothers năm 2022 đạt vỏn vẹn 13 tỷ đồng, giảm mạnh 75% so với cùng kỳ 2021."
670,2023-01-30 10:40:00,"Khoản đầu tư ""đắt xắt ra miếng"" của giới thượng lưu: Người có tiền chưa chắc đã mua được, được đánh giá hấp dẫn hơn cả vàng và chứng khoán Được bán với giá hàng trăm nghìn USD, những chiếc túi Birkin vẫn được nhiều người săn đón và sẵn sàng bỏ ra số tiền lớn hơn nhiều để sở hữu sản phẩm này."
671,2023-01-30 08:57:00,"Các công ty chứng khoán 'đốt' bao nhiêu tiền cho cuộc đua giành thị phần môi giới? Việc có thể ""xưng vương"" trong cuộc chiến giành thị phần môi giới cũng đồng nghĩa với việc nhiều công ty chứng khoán phải bỏ ra nhiều chi phí để thu hút khách hàng."
672,2023-01-29 10:00:00,"Bí mật giúp thần chứng khoán kiếm tiền từ khi mới 13: Tuổi trẻ sẵn sàng làm điều này, phần đời còn lại tuyệt đối không hối hận Bài học này đã được Warren Buffett đề cập đến trong các lá thư gửi cổ đông thường niên của Berkshire Hathaway, và ông đã nhấn mạnh nó một lần nữa ở thời điểm 16 năm sau."
673,2023-01-27 21:40:00,"Bài toán kinh tế đầu năm: Cầm tiền mừng tuổi của con nên tiêu ngay, cất đi, gửi ngân hàng, mua vàng hay đầu tư chứng khoán? Đầu năm, với khoảng tiền nhàn rỗi, ví dụ như tiền mừng tuổi của con, nếu chi tiêu luôn, gửi ngân hàng, mua vàng, đầu tư chứng khoán thì sẽ tác động như thế nào đến nền kinh tế? Hãy cùng nhìn lại các kênh tiền chảy trong nền kinh tế năm 2023 để thấy người Việt nói chung đang ưa chuộng hình thức nào nhất."
674,2023-01-27 11:05:00,"Đầu tư chứng khoán gần 90 năm không thua lỗ, người đàn ông Do Thái hơn 100 tuổi tiết lộ: Danh mục đầu tư như vườn cây, đừng đòi hỏi tất cả các cây trong vườn cho trái quanh năm Ở thời điểm 1930, trong khi tất cả các nhà đầu tư bị thua lỗ, người đàn ông này lại kiếm được bộn tiền và trở nên nổi tiếng ở phố Wall. Dẫu không phải là người được hưởng lãi cao nhất khi thị trường tăng trưởng tuy nhiên ông có thể duy trì chuỗi đầu tư gần 90 năm không lỗ."
675,2023-01-27 09:55:00,"Không dự báo xu hướng thời trang, chiếc áo sơ mi này có khả năng thay đổi giá theo thị trường chứng khoán Trước những biến động của thị trường, nhà sản xuất áo sơ mi nam của Thụy Điển Eton Shirts và công ty sáng tạo Valtech Radon đã phát triển The Index Shirt."
676,2023-01-27 09:24:00,"Chứng khoán Việt Nam thường diễn biến ra sao những ngày ""khai xuân"" đầu năm mới? Thống kê 22 năm qua, xác suất VN-Index tăng điểm trong 5 ngày đầu tiên của năm mới gần 64% với mức tăng trung bình 1,13%."
677,2023-01-27 08:00:00,"Loạt công ty chứng khoán “việt vị” với khoản lỗ kỷ lục trong quý 4 của Hoà Phát Thực tế cho thấy những cú ""quay xe"" hạ dự báo của đội ngũ phân tích các CTCK vẫn còn ""quá tích cực""."
678,2023-01-25 09:20:00,"Dốc tiền vào chứng khoán năm 2023, nhà đầu tư cần lưu ý gì? Trong bối cảnh thị trường chứng khoán diễn biến khó lường, xu hướng phục hồi có thể thể gập ghềnh, nhà đầu tư cần thận trọng để giảm thiểu rủi ro."
679,2023-01-25 08:20:00,"Lý giải sự cố ""sập"" sàn giao dịch chứng khoán New York: Chúng ta đã biết những gì? Dù khó tin nhưng rất nhiều cổ phiếu lớn đã bị ảnh hưởng trong sự cố đầu phiên giao dịch ngày 24/1, để lại hàng loạt những câu hỏi cần sự giải đáp."
680,2023-01-24 07:23:00,"Chứng khoán Yuanta: NHNN đang xem xét room ngoại cho HDBank, MB và VPBank lên trên 30% Theo Yuanta Việt Nam, NHNN gần đây đang xem xét việc nới room ngoại cho các ngân hàng đã tham gia tái cơ cấu các ngân hàng yếu kém (như HDBank, MB và VPBank) lên cao hơn so với mức hiện tại là 30%, nhưng sẽ không vượt qua mức 49%."
681,2023-01-23 20:42:00,Những tỷ phú giàu 'bền vững' trên sàn chứng khoán Việt Tuy tài sản giảm mạnh sau năm 2022 nhiều biến động nhưng đây vẫn là những cái tên đình đám trên sàn chứng khoán Việt.
682,2023-01-23 18:03:00,"Vinacapital: Định giá rẻ nhất trong 10 năm, chứng khoán Việt Nam sẽ tăng mạnh trong ít nhất 5 năm tới Theo Vinacapital, nền kinh tế và thị trường chứng khoán Việt Nam vẫn đang ở trong giai đoạn tăng trưởng cao trong ít nhất 5 năm tới và các nhà đầu tư trong và ngoài nước sẽ không bỏ qua cơ hội này."
683,2023-01-23 16:23:00,"Chứng khoán 'lên dây cót' cho năm 2023 Bà Tạ Thanh Bình - Vụ trưởng Vụ Phát triển thị trường chứng khoán cho biết, TTCK Việt Nam năm 2022 đã có xu hướng giảm trong nhiều tháng nhưng vẫn là một thị trường quan trọng cho nền kinh tế, góp phần cơ cấu lại hệ thống tài chính Việt Nam theo hướng cân đối, bền vững hơn."
684,2023-01-23 09:40:00,"Chuyên gia phong thuỷ Phạm Cương: Chứng khoán tiếp tục vận động theo xu hướng ""tiền hung hậu cát"", có khả năng test lại đáy năm 2022 Theo chuyên gia phong thuỷ, VN-Index có thể chinh phục mốc 1.300 điểm, nếu đà hưng phấn kéo dài kết hợp với các điều kiện vĩ mô thuận lợi chỉ số có thể cán mốc 1.360 điểm cuối năm."
685,2023-01-22 09:13:00,"Loạt phát ngôn ""ăn tiền"" của Táo kinh tế 2023: ""Chứng khoán đảo chiều rồi, mời mọi người đầu tư"" Tuy mỗi năm chỉ lên sóng một lần vào đêm Tất niên, nhưng chương trình Táo Quân luôn ""gây bão"" bởi hàng loạt câu nói bắt trend vô cùng thâm thúy."
686,2023-01-22 08:26:00,"Chứng khoán Việt Nam 2023: Sẵn sàng đón vận hội mới 2023 được dự báo sẽ là một năm không dễ dàng đối với chứng khoán Việt Nam bởi những rủi ro tiềm ẩn đến từ cả bên trong và bên ngoài. Dù vậy, vẫn có nhiều cơ hội đầu tư hấp dẫn chờ đợi nhà đầu tư nắm bắt."
687,2023-01-22 08:12:00,"'Đặc sản' Táo xã hội với loạt câu nói bắt trend gây bão từ chủ đề bất động sản đến chứng khoán khiến giới đầu tư giật mình ""Táo"" Tự Long tiếp tục chiêu đãi khán giả cả nước với loạt câu nói thâm sâu nhắc đến những chủ đề nổi bật của năm qua từ chứng khoán đến bất động sản."
688,2023-01-21 08:01:00,"Tài sản các tỷ phú trên sàn chứng khoán thay đổi thế nào trong năm 2022? Tại thời điểm cuối năm 2021, tổng tài sản của 10 người giàu nhất sàn chứng khoán đạt khoảng 562 nghìn tỷ đồng. Sau 1 năm, con số này đã giảm xuống 291 nghìn tỷ đồng vào cuối năm 2022, tương ứng mức giảm gần 50%."
689,2023-01-19 20:50:00,"Chứng khoán SSI lãi 2.110 tỷ đồng năm 2022 SSI báo lãi 289 tỷ đồng quý 4/2022, nâng lợi nhuận cả năm lên 2.110 tỷ đồng."
690,2023-01-18 13:15:00,"Nghiên cứu sắc thuế riêng với chứng khoán phái sinh Theo dự thảo, kinh nghiệm quốc tế cho thấy các nền kinh tế đều dần chuyển sang đánh thuế dựa trên thu nhập thực đối với chứng khoán phái sinh."
691,2023-01-17 08:45:00,"“Thần chứng khoán Trung Quốc” tự xưng giàu hơn Jack Ma, “đầu cơ cổ phiếu dễ như mua rau”, trả lương tài xế và người giúp việc mấy chục triệu USD Lâm Viên được biết đến là đại cổ đông của hãng đồ uống nổi tiếng tại Trung Quốc, ông có 18 năm kinh nghiệm đầu tư trên thị trường chứng khoán, những thắng lợi của ông được trong giới tương truyền là huyền thoại."
692,2023-01-16 20:00:00,"Hàng loạt cá nhân, tổ chức bị phạt do phạm lỗi trên thị trường chứng khoán Chỉ trong vòng một tuần nay, Uỷ ban chứng khoán Nhà nước đã ban hành hàng loạt quyết định xử phạt cá nhân, tổ chức vi phạm liên quan đến phát hành trái phiếu, công bố thông tin, giao dịch cổ phiếu..."
693,2023-01-16 16:42:00,"BIDV trở thành á quân vốn hóa thị trường chứng khoán Việt Nam, ""vượt mặt"" bộ đôi Vingroup So với vùng đáy ngắn hạn vào tháng 10/2022, đà tăng của cổ phiếu đã đẩy vốn hóa BIDV tăng gần 82.000 tỷ đồng."
694,2023-01-16 15:29:00,"Công ty chứng khoán đầu tiên công bố lợi nhuận năm 2022, lãi gấp 6 lần cùng kỳ nhờ lãi tiền gửi và trái phiếu Lợi nhuận trước và sau thuế cả năm 2022 của JBVN tăng gấp 6 lần và 5 lần cùng kỳ năm trước, tương ứng đạt 34 tỷ đồng và 27 tỷ đồng."
