,Published_time,news_content
1223,2022-04-02 15:38:00,"Khẩn trương điều tra những cá nhân giúp Trịnh Văn Quyết thao túng thị trường chứng khoán Trong trường hợp cơ quan chức năng đã xử phạt hành chính mà sau đó xác định hành vi vi phạm đủ cấu thành tội phạm, phải xử lý hình sự thì Cơ quan điều tra sẽ khởi tố để điều tra, xử lý theo quy định của pháp luật."
1224,2022-04-01 20:31:00,"Thao túng, thổi giá làm loạn thị trường bất động sản, sao chưa xử như thao túng chứng khoán? Bất động sản sốt nóng tại nhiều nơi do bị một số nhóm đầu cơ bơm thổi đẩy giá, gây sốt nóng, thao túng thị trường. Các hành vi này có phạm pháp không và liệu có bị xử lý?"
1225,2022-04-01 20:05:00,"Tập đoàn FLC đề nghị tạm ngừng, đình chỉ giao dịch đối với cổ phiếu FLC và kiểm tra dấu hiệu bất thường trong phiên giao dịch chứng khoán 1/4 Ngày 1/4, Công ty cổ phần Tập đoàn FLC có văn bản gửi Bộ Tài chính, Ủy ban Chứng khoán Nhà nước, Sở Giao dịch Chứng khoán TPHCM, Trung tâm Lưu ký Chứng khoán về việc ""Áp dụng biện pháp bảo đảm an ninh, an toàn thị trường chứng khoán""."
1226,2022-04-01 11:24:00,"Thiên tài gốc Việt 12 tuổi: Nhận học bổng của ĐH top 1% thế giới, được trường cử đội an ninh riêng để bảo vệ, đầu tư chứng khoán suốt nhiều năm ""Alisa là sinh viên nhỏ tuổi nhất từ trước đến nay của trường chúng tôi. Cô bé gây ấn tượng với mọi người bằng sự trưởng thành và thông minh""."
1227,2022-04-01 10:05:00,"Người Trung Quốc từ bỏ đầu tư chứng khoán, chuyển sang tích trữ tài sản, nhà đất Đại dịch đã bước qua năm thứ 3 tại Trung Quốc và người dân nước này bắt đầu đổ xô tích trữ tài sản, đặc biệt là trong mảng nhà đất."
1228,2022-03-31 20:16:00,"""Các vụ Nguyễn Phương Hằng, thao túng chứng khoán có tính chất thách thức pháp luật"" Thường trực Ban Bí thư Võ Văn Thưởng cho rằng, 3 vụ là nhóm ""báo sạch"", Nguyễn Phương Hằng, thao túng thị trường chứng khoán là những sai phạm có tính chất thách thức đường lối, chủ trương của Đảng, pháp luật của Nhà nước, thách thức dư luận."
1229,2022-03-31 20:15:00,"Chứng khoán VPS nói gì về sự cố lỗi hệ thống suốt 1 giờ đồng hồ khiến nhà đầu tư không thể giao dịch? Nắm thị phần môi giới lớn nhất thị trường, nhưng Chứng khoán VPS vừa gặp lỗi giao dịch suốt gần 1 giờ đồng hồ chiều ngày 31/3, khiến nhiều nhà đầu tư bức xúc."
1230,2022-03-31 19:10:00,"Uỷ ban Kiểm tra Trung Ương: Ông Vũ Bằng, Trần Văn Dũng, Nguyễn Thành Long, Lê Hải Trà, Nguyễn Sơn chịu trách nhiệm về những vi phạm, khuyết điểm trong lĩnh vực chứng khoán ""Những vi phạm nêu trên đã gây hậu quả nghiêm trọng, ảnh hưởng tiêu cực đến thị trường chứng khoán, giảm niềm tin của các nhà đầu tư, uy tín của tổ chức đảng và Ủy ban Chứng khoán Nhà nước, gây bức xúc trong xã hội, đến mức phải xem xét, xử lý kỷ luật""."
1231,2022-03-31 15:39:00,"Loạt doanh nhân nổi tiếng bước ra từ ngành luật: Từ người phụ nữ giàu thứ 2 sàn chứng khoán đến chủ tịch SSI, KBC... Phó Chủ tịch Vingroup Phạm Thu Hương, Chủ tịch Kinh Bắc Đặng Thành Tâm hay Chủ tịch SSI Nguyễn Duy Hưng,... và nhiều gương mặt lừng lẫy trên thương trường khác đều từng nhận tấm bằng luật trước khi trở thành những gương mặt giàu nhất sàn chứng khoán Việt với số tài sản đáng mơ ước."
1232,2022-03-31 09:20:00,"“P/E Chứng khoán Việt Nam thấp hơn Thái Lan là điều không hợp lý, hoàn toàn xứng đáng với mức định giá tốt hơn” Trong 8 năm qua, chứng khoán Thái Lan chỉ có mức tăng trưởng 20% thì chứng khoán Việt Nam lại mang về mức sinh lợi lên tới 140%. Điều này bắt nguồn từ việc tăng trưởng lợi nhuận thấp của các doanh nghiệp Thái Lan so với Việt Nam."
1233,2022-03-31 08:52:00,"Chuyên gia chỉ điểm 3 sai lầm tâm lý kinh điển khiến nhà đầu tư dễ mất tiền, cháy tài khoản trên thị trường chứng khoán Việt Nam Sau đây là một số sai lầm phổ biến về mặt tâm lý mà các nhà đầu tư mắc phải trên thị trường chứng khoán Việt Nam."
1234,2022-03-31 08:19:00,"""Tiền đẻ ra tiền"" từ vàng, chứng khoán cho tới túi hiệu, bất động sản: Gái xinh hé lộ chiêu để 10 năm chưa bao giờ lỗ! Đầu tư chưa bao giờ lỗ? Tin được không đây?"
1235,2022-03-30 17:31:00,"Ông Lê Hải Trà nói gì về thị trường chứng khoán bị thao túng từ vụ ông Trịnh Văn Quyết? Sau lùm xùm việc bắt ông Trịnh Văn Quyết liên quan đến việc thao túng thị trường chứng khoán, ông Lê Hải Trà, Tổng Giám đốc Sở Giao dịch chứng khoán TP.HCM (HoSE) có cuộc trao đổi với Tiền Phong chiều ngày 30/3."
1236,2022-03-30 15:40:00,"“Bạo chúa Phố Wall” Ivan Boesky: Nỗi khiếp sợ của doanh nghiệp yếu thế, vào tù vì bê bối trên thị trường chứng khoán và cái kết lụi tàn Thị trường chứng khoán Mỹ từng ghi nhận không ít các vụ bê bối giao dịch nội gián. Đình đám nhất trong số đó không thể thiếu nhà đầu cơ khét tiếng Ivan Boesky."
1237,2022-03-30 15:06:00,"Vì sao sự kiện khởi tố, bắt tạm giam Chủ tịch FLC không ảnh hưởng lớn đến thị trường chứng khoán phiên sáng nay? Các chuyên gia đánh giá thị trường sáng nay diễn biến tích cực và tâm lý nhà đầu tư khá bình tĩnh. Điều này hoàn toàn khác so với diễn biến thị trường hồi tháng 1 khi thông tin cũng gần như tương tự."
1238,2022-03-30 14:46:00,'Thần chứng khoán' Warren Buffett khẳng định: Đây mới thực sự là cách dễ dàng nhất để tăng 50% giá trị của bản thân Nhà đầu tư huyền thoại kiêm tỷ phú Warren Buffett có một mẹo nhỏ dành cho những người trẻ tuổi giúp tăng giá trị của bản thân.
1239,2022-03-30 11:07:00,"Sau tin Chủ tịch FLC bị bắt, 'vua chứng khoán' Nguyễn Duy Hưng nhắc lại câu chuyện chủ tịch ngân hàng đi tù, kèm lời nhắn nhủ những bạn trẻ đi làm thuê Ngay sau khi thông tin Chủ tịch Tập đoàn FLC Trịnh Văn Quyết bị bắt tạm giam, Chủ tịch Công ty Chứng khoán Sài Gòn (SSI) Nguyễn Duy Hưng đã có động thái đáng chú ý."
1240,2022-03-30 10:49:00,"Nhìn lại những vụ khởi tố hình sự trên thị trường chứng khoán Việt Nam, đã từng có mức phạt lên tới... tù chung thân Trong lịch sử hơn 21 năm hoạt động, mức phạt nặng nhất về xử lý hình sự trên thị trường chứng khoán cho đến thời điểm hiện tại thuộc về công ty MTM khi nguyên Chủ tịch Trần Hữu Tiệp bị xử tù chung thân về tội Lừa đảo chiếm đoạt tài sản."
1241,2022-03-30 08:37:00,"Ai giúp sức ông Trịnh Văn Quyết thao túng thị trường chứng khoán? Trong vụ án “Thao túng thị trường chứng khoán”, ngoài ông Trịnh Văn Quyết, CQĐT còn xác minh đối với cá nhân thuộc Công ty CP Tập đoàn FLC, Công ty CP Chứng khoán BOS và các công ty có liên quan. Ngoài trụ sở FLC, nhà riêng ông Quyết, CQĐT đã tổ chức khám xét chỗ ở, nơi làm việc tại 21 địa điểm đối với các đối tượng liên quan."
1242,2022-03-30 08:35:00,"Tung hoành trên Twitter thao túng chứng khoán bị phạt, Musk vừa kiện ngược Uỷ ban Chứng khoán và Giao dịch Mỹ Elon Musk khẳng định Uỷ ban Chứng khoán và Giao dịch Mỹ ""làm sai"" trong cuộc điều tra nhắm vào ông."
1243,2022-03-29 20:38:00,"Bán ‘chui’, thao túng giá chứng khoán: Mỹ phạt tù 20 năm và tối đa 25 triệu USD, Hong Kong bỏ tù 10 năm và hơn 1 triệu USD Luật pháp tại nhiều nước phát triển đưa ra hình phạt tương đối nặng để răn đe các hành vi gian lận về kinh tế trong lĩnh vực chứng khoán."
1244,2022-03-29 17:07:00,"Từ case study của Vinamilk, chuyên gia chứng khoán bật mí cách đánh giá nhanh bất kỳ cổ phiếu nào chỉ cần nhìn qua một chỉ số Theo ông Lã Giang Trung, Vinamilk là một doanh nghiệp tốt, quản trị doanh nghiệp tốt, tài chính tốt, ông có thể chấp nhận mức P/E khoảng 8 lần. Hiện tại P/E của doanh nghiệp này là khoảng 15 lần."
1245,2022-03-29 11:22:00,"Vì sao nhà đầu tư chứng khoán lại phản ứng với cổ phiếu Sacombank khi nghe tin đồn liên quan đến Chủ tịch FLC Trịnh Văn Quyết? Theo tính toán, FLC phải trả khoảng gần 600 tỷ đồng/năm cho khoản vay trung dài hạn tại Sacombank."
1246,2022-03-29 09:12:00,Nhà đầu tư 'chen' bán gần 100 triệu cổ phiếu FLC ngay khi mở cửa thị trường chứng khoán Các cổ phiếu 'họ FLC' tiếp tục bị bán tháo ngày thứ 2 liên tiếp.
1247,2022-03-29 09:05:00,Điểm khác biệt giữa cá cược đua ngựa và đầu tư chứng khoán Sự khác nhau giữa cá cược đua ngựa và đầu tư chứng khoán là gì?
1248,2022-03-29 08:37:00,"Học đầu tư theo Warren Buffett, một sếp chứng khoán từng chầu chực tại cửa hàng Bách Hoá Xanh đến mức biết DN dùng bao nhiêu giấy vệ sinh mỗi tháng Bắt đáy cổ phiếu Thế giới di động vào năm 2016 sau khi giảm mạnh 50%, danh mục của ông Lã Giang Trung tăng 4-5 lần chỉ sau 1-2 năm."
1249,2022-03-28 14:53:00,"Cổ phiếu 'họ FLC' bị bán tháo vì tin đồn, chuyên gia chứng khoán đánh giá như thế nào? CEO Passion Investment cho rằng với những nhà đầu tư bỏ tiền vào cổ phiếu mang tính đầu cơ thì họ cũng đã có tâm thái sẵn sàng đi ra."
1250,2022-03-28 14:21:00,"""Được phím hàng nhưng cảm thấy không chuẩn"", Hoa hậu sàn chứng khoán Ngọc Hân tự xác định vị thế có lần chốt lãi đến 150% Hoa hậu Ngọc Hân không chỉ nổi tiếng về nhan sắc mà còn có tài năng trong kinh doanh, đầu tư. Ngoài sự nghiệp riêng, thì đầu tư chứng khoán cũng là một trong những công việc tay trái sinh lời của người đẹp."
1251,2022-03-28 09:08:00,"Cổ phiếu 'họ FLC' bị bán tháo, giảm sàn ngay khi thị trường chứng khoán mở cửa Nhà đầu tư đặt bán hàng chục triệu cổ phiếu FLC và ROS ngay khi thị trường mở cửa. Các mã HAI, KLF, AMD, ART cũng bị bán hàng triệu đơn vị."
1252,2022-03-27 11:40:00,"Đầu tư Bất động sản có thực sự an toàn hơn đầu tư chứng khoán? Trong mỗi giai đoạn kinh tế, tùy thuộc vào khả năng tài chính và sự am hiểu của nhà đầu tư đối với lĩnh vực mình đầu tư thì sự rủi ro sẽ khác nhau."
1253,2022-03-25 17:12:00,"Giám đốc đầu tư chứng khoán Tân Việt: Lập gia đình còn rủi ro hơn đầu tư chứng khoán! Theo chuyên gia Nguyễn Trung Du, trong cuộc sống thì chứng khoán là dễ nhất, sai thì chỉ mất tiền và học được bài học."
1254,2022-03-25 11:01:00,"“Chốt” lãi chứng khoán, nhà đầu tư “trú ẩn” vào bất động sản trước nỗi lo lạm phát Nhiều nhà đầu tư chốt lời từ chứng khoán và một số kênh đầu tư khác đang chuyển dịch dòng tiền vào bất động sản vì cho rằng nhà đất vẫn là nơi găm giữ tài sản an toàn, tiềm năng tạo ra nguồn lợi nhuận lớn."
1255,2022-03-25 09:13:00,"Chân dung 2 tỷ phú trẻ nhất của Nga: Người làm giàu từ môi giới chứng khoán, người phất lên nhờ công nghệ Theo bảng xếp hạng Real Time của Forbes, Nga hiện có 2 tỷ phú dưới 40 tuổi là Timur Turlov (34 tuổi) và Pavel Durov (37 tuổi)."
1256,2022-03-25 06:47:00,"Nhà đầu tư bỏ tiền vào vàng, chứng khoán hay bất động lúc lạm phát? Nền kinh tế toàn cầu năm 2022 chứng kiến nhiều biến động từ leo thang chiến sự giữa Nga và Ukraine; áp lực lạm phát, nguy cơ gián đoạn chuỗi cung ứng thêm một lần nữa... Trong bối cảnh đó, chứng khoán và bất động sản được đánh giá vẫn là kênh đầu tư có tỷ suất sinh lời cao nhất."
1257,2022-03-25 06:26:00,"Nhiều doanh nghiệp Việt rời xa lĩnh vực cốt lõi để phiêu lưu với chứng khoán: Con đường của Berkshire Hathaway không dễ đi! Trong bối cảnh đại dịch Covid-19 ảnh hưởng nặng nề đến các lĩnh vực sản xuất kinh doanh truyền thống, nhiều doanh nghiệp không ngần ngại đem tiền đầu tư chứng khoán để “cứu” lợi nhuận nhưng không phải lúc nào cũng thu về “quả ngọt”."
1258,2022-03-24 07:50:00,"Bóc trần Phishing: Thủ đoạn lừa đảo chứng khoán tinh vi chào mời qua Facebook, Zalo, chứng sĩ lơ mơ là mất sạch tiền! Sau khi đặt vấn đề giao dịch chứng khoán thông qua các hội nhóm, fanpage, Facebook…, Phisher sẽ yêu cầu cho biết số tài khoản để thanh toán chuyển khoản, yêu cầu người bán kiểm tra số tiền chuyển về bằng việc click vào các đường link na ná website của các công ty chứng khoán..."
1259,2022-03-23 10:49:00,"Một doanh nghiệp hóa chất trên sàn chứng khoán tăng hơn 1 tỷ USD vốn hóa sau một năm Tại mức giá 213.400 đồng/cp, vốn hóa thị trường của Hóa chất Đức Giang vượt mốc 36.500 tỷ đồng (1,6 tỷ USD), tương ứng tăng hơn 26.200 tỷ đồng (1,1 tỷ USD) so với thời điểm tháng 3/2021."
1260,2022-03-23 10:15:00,"SOS: Ủy ban Chứng khoán cảnh báo về lỗ hổng bảo mật ở CTCK, nhà đầu tư thận trọng trước rủi ro tài khoản bị chiếm quyền sử dụng Các Hackers hiện đã nắm được một số thông tin cụ thể của khách hàng như tên truy cập và mật khẩu đăng nhập, Ủy ban Chứng khoán Nhà nước cảnh báo."
1261,2022-03-23 09:02:00,"'Thần chứng khoán' Warren Buffett và Bill Gates khẳng định: Chỉ cần bỏ 1 điều, không những giỏi mà còn giàu nhanh Bill Gates và Warren Buffett, hai ông trùm kinh doanh cực kỳ thành công là ví dụ điển hình về chiến lược từ bỏ này nhằm giúp chinh phục những mục tiêu lớn trong cuộc đời."
1262,2022-03-22 17:18:00,"Một mã chứng khoán rẻ hơn que kem, cổ tức 16% nhưng cả tháng không ai mua bán? Hơn 3 năm lên sàn, công ty có mã chứng khoán này gần như không có giao dịch."
1263,2022-03-21 23:12:00,"Vàng, bất động sản, chứng khoán, USD: Kênh đầu tư nào sinh lời cao nhất trong 5, 10, 15 và 21 năm qua? Nếu đầu tư cổ phiếu từ 21 năm trước, bình quân số tiền thu về hiện gấp hơn 19 lần. Con số này đối với kênh bất động sản là 10,6 lần, trái phiếu là 6,6 lần, vàng là 6,1 lần, còn USD chỉ tăng 58%."
1264,2022-03-21 19:34:00,"Lộ diện 1 công ty chứng khoán có tham gia góp vốn vào Nanogen Theo dòng sự kiện cùa ngày hôm nay, Nanogen và ông Hồ Nhân là những cái tên được chú ý. Trong cơ cấu cổ đông của Nanogen theo ghi nhận có một công ty chứng khoán."
1265,2022-03-20 10:37:00,"Đừng đầu tư chứng khoán theo kiểu ""tung đồng xu"" mà cần phải hiểu thật rõ doanh nghiệp đang nắm giữ Tuy chứng khoán vẫn là kênh sinh lời tốt trong bối cảnh địa chính trị bất ổn, song nhà đầu tư cần cẩn trọng trong mỗi quyết định mua bán."
1266,2022-03-19 17:18:00,"Tập đoàn mẹ Batdongsan.com.vn chính thức niêm yết trên sàn chứng khoán New York, giá mở cửa 8,61 USD/cổ phiếu Tập đoàn PropertyGuru – công ty mẹ của Batdongsan.com.vn chính thức niêm yết trên sàn chứng khoán New York, Mỹ (NYSE) với mã chứng khoán PGRU."
1267,2022-03-18 16:26:00,"Hoa hậu Ngọc Hân thừa nhận được “phím hàng” từ Chủ tịch, Tổng giám đốc khi đầu tư chứng khoán: Tốt nhất là không nên nghe! Ngọc Hân cho biết mình có được chủ tịch này, tổng giám đốc kia phím hàng nhưng không hiểu sao nguồn tin của cô rất hay… không chuẩn."
1268,2022-03-18 14:58:00,"Từ kẻ vô danh ngoi lên vị trí ông trùm chỉ với 5 đô la, tỷ phú chứng khoán ""làm mưa làm gió"" một thời, đau đớn để lại di thư: ""Cuộc đời tôi là một thất bại"" Livermore được biết đến với biệt danh ""vua đầu cơ"", đã từng đứng ở đỉnh cao của thành công nhưng đáng tiếc sự nghiệp của ông ""sớm nở chóng tàn""."
1269,2022-03-17 16:39:00,"Không riêng Mai Phương Thúy, Hoa hậu Ngọc Hân cũng là dân ""chơi"" chứng khoán thứ thiệt: Từng có khoản đầu tư lãi tới 150%, thỉnh thoảng xóa app cho đỡ nặng đầu! Hoa hậu Ngọc Hân cho biết mình tham gia thị trường từ năm 2017 và khoản đầu tư lãi nhất khi mới tham gia thị trường đạt mức 150%."
1270,2022-03-16 21:45:00,"Chứng khoán Trung Quốc ‘bùng nổ’ mạnh nhất trong 14 năm nhờ tín hiệu hỗ trợ Chỉ số chứng khoán trên sàn giao dịch Hong Kong và Trung Quốc đại lục ngày 16/3 có phiên tăng mạnh, sau khi Quốc vụ viện Trung Quốc cam kết duy trì ổn định thị trường chứng khoán."
1271,2022-03-16 14:45:00,"BĐS năm 2022 hừng hực khí thế nhưng cần thận trọng khi giá dầu, giá vàng, chứng khoán… liên tục chao đảo Ngay từ đầu năm 2022, mặc dù diễn biến dịch vẫn phức tạp nhưng thị trường hừng hực khí thế ở mọi vùng miền, các giao dịch bất động sản vẫn khá sôi động nhưng vẫn không ít thách thức."
1272,2022-03-16 14:06:00,"VnIndex giằng co quanh mốc 1500, chuyên gia chứng khoán mách nước nhà đầu tư cách kiếm tiền trong “thị trường Kangaroo” Thị trường chứng khoán Việt Nam không có xu hướng rõ ràng khi dao động trong biên độ hẹp từ 1430 đến 1530. Các chuyên gia cho rằng vẫn có cách để kiếm tiền dù khá là khó."
1273,2022-03-16 08:42:00,"Thời tới cản không kịp, lợi nhuận doanh nghiệp sản xuất bao cao su duy nhất trên sàn chứng khoán tăng phi mã lên hơn 1 triệu USD Tuy vậy nhiều khả năng lợi nhuận của Merufa bứt phá nhờ găng tay y tế - sản phẩm có nhu cầu tăng đột biến từ khi đại dịch bắt đầu."
1274,2022-03-16 08:24:00,"Tư duy đầu tư của “bà hoàng chứng khoán”, người đẹp bất động sản Việt: Mất ngủ vì 10 triệu thì làm sao kiếm được 20 triệu, chờ đến lúc “sốt đất” mới đầu tư thì muộn rồi Mai Phương Thúy, Midu hay Lý Nhã Kỳ là những người đẹp của showbiz Việt sở hữu khối tài sản khủng nhờ thành công trong hoạt động đầu tư bất động sản cho đến chứng khoán."
1275,2022-03-14 16:46:00,"Hòa Phát soán ngôi Vingroup, trở thành 'vua tiền mặt' sàn chứng khoán Việt Nam Trong năm qua, lượng tiền của Hòa Phát tăng thêm tới gần 19.000 tỷ đồng, trong khi tiền của Vingroup giảm khoảng 13.500 tỷ đồng. Có 6 doanh nghiệp đang sở hữu 1 tỷ USD tiền trong tài khoản."
1276,2022-03-14 11:43:00,"Cổ phiếu ngân hàng của người giàu thứ 3 trên sàn chứng khoán bất ngờ tăng trần, trở thành nhà băng sinh lời tốt nhất tháng 3 Trong tháng 3, vốn hóa của phần lớn các ngân hàng trên sàn chứng khoán đều giảm. Trong khi đó, vốn hóa của KienlongBank lại tăng 2.747 tỷ đồng, tương đương mức tăng tới 28%."
1277,2022-03-11 19:32:00,"6 bí quyết đầu tư của 'thần chứng khoán' Warrent Buffett giúp bạn tiết kiệm được 10 năm đi vòng: Thành công không chỉ nằm ở 2 chữ 'lãi kép' Trong số các tỷ phú hàng đầu thế giới, dưới góc độ đầu tư và quản lý tài chính, ""thần chứng khoán"" Warrent Buffett luôn là cái tên đứng đầu khi bàn về cách kiếm tiền giỏi."
1278,2022-03-11 09:18:00,"Công ty chứng khoán đặt kế hoạch ""đi lùi"" gần 50% trong năm 2022, dự kiến tăng vốn lên mức 1.900 tỷ đồng, muốn chuyển sàn từ UPCOM sang HOSE HĐQT PHS dự kiến trình cổ đông thông qua phương án trả cổ tức năm 2021 theo tỷ lệ tổng cộng là 11,95%, gồm cổ tức bằng tiền tỷ lệ 4,8% (mỗi cổ phiếu nhận về 480 đồng và cổ tức bằng cổ phiếu tỷ lệ 7,15% (mỗi 100 cổ phiếu nhận về 7,15 cổ phiếu mới)."
1279,2022-03-11 09:05:00,"Tuổi 20 đẹp nhất để đầu tư chứng khoán: ""Hai lần cháy tài khoản, nợ nần vì dính cổ phiếu nằm sàn 20 phiên, tôi làm lại từ đầu, tài sản tăng 20 lần 2 năm qua"" ""Tuổi 20 là tuổi đẹp nhất để tham gia đầu tư chứng khoán, cái tuổi mà kiến thức nền tảng phổ thông đã tròn vẹn, tuổi mà bản thân còn trẻ để dung nạp kiến thức, có nhiều thời gian để học hỏi và đặc biệt là có cơ hội thử nghiệm, cơ hội làm lại. Việc cháy tài khoản vài chục triệu ở tuổi 20 vẫn rẻ chán so với cháy tài khoản dành dụm sau nhiều năm đi làm ở tuổi 30!"""
1280,2022-03-10 15:28:00,"Sinh viên đại học ôm khối nợ gần 8 tỷ đồng vì chứng khoán: Thành bại tại cổ phiếu Hoàng Anh Gia Lai 21 tuổi chưa rời khỏi giảng đường mà tôi đã ôm khối nợ gần 8 tỷ vì chứng khoán, đã có lúc tôi muốn tự tử vì mỗi tháng chỉ riêng tiền lãi vay (cả margin) đã hơn 100 triệu/tháng. Đến bây giờ tôi cũng không ngờ được là mình vẫn còn ngồi đây và kể với bạn nghe câu chuyện của tôi ở tuổi 20, và nó chẳng gì nhiều ngoài 2 từ ""biết ơn""."
1281,2022-03-10 08:06:00,"USD giảm mạnh, vàng mất mốc 2.000 USD, Euro, Bitcoin và chứng khoán tăng vọt Giá hàng hóa giảm và các nhà đầu tư chấp nhận rủi ro khiến đồng Euro và cổ phiếu phục hồi mạnh mẽ trong khi USD giảm. Bitcoin tăng mạnh 9% lên trên 42.000 USD sau động thái của ông Biden."
1282,2022-03-09 23:40:00,"Khi chị em “đua nhau” chơi chứng khoán: Trả giá đắt vì nghe lời ""phím hàng"", muốn tăng huyết áp vì chuyện đỏ xanh Hội chị em chơi chứng khoán cũng ra công chuyện đấy."
1283,2022-03-09 16:37:00,"Hoa hậu làng bank: Các chuyên gia chứng khoán nói về 7 cổ phiếu ngân hàng cực hot, 3 chữ cái nào xứng đáng để 'chọn mặt gửi tiền'? Cổ phiếu ngân hàng nào đáng để các nhà đầu tư “chọn mặt gửi tiền” trong 7 mã cổ phiếu sau: VCB, TCB, VPB, MBB, TPB, LPB, STB."
1284,2022-03-09 16:05:00,"13 năm sống sót trên thị trường chứng khoán, tài khoản tăng hàng chục lần: ""Tôi không mua cổ phiếu ‘vô chủ', đứng núi này trông núi nọ là điểm đen trong đầu tư"" Nguyên tắc đầu tư của anh Lê Kế Thọ được tóm gọn trong 5 chữ: Phù thịnh không phù suy, tập trung vào các doanh nghiệp có yếu tố kinh doanh cốt lõi, ưu tiên các doanh nghiệp đầu ngành tăng trưởng tốt hoặc các doanh nghiệp đã thoát khỏi khủng hoảng và phù hợp với thiên thời, chính sách ở giai đoạn mình đầu tư đó, không đầu tư cổ phiếu vô chủ."
1285,2022-03-09 09:55:00,Nên gửi tiết kiệm hay đầu tư chứng khoán? Cuộc khẩu chiến dường như không có hồi kết!!! Đầu tư chứng khoán hay gửi tiết kiệm phù hợp hơn với mục tiêu tài chính của bạn?
