,Published_time,news_content
1851,2021-01-07 08:13:00,"10 năm qua, ""quyền lực"" môi giới chứng khoán của những công ty hàng đầu đã thay đổi như thế nào? Trong 10 năm qua, SSI và HSC là 2 công ty chứng khoán luôn góp mặt trong top 10, và cũng gần như chiếm trọn 2 vị trí dẫn đầu. Tuy nhiên, cán cân quyền lực đang có dấu hiệu thay đổi trong những quý cuối năm 2020 với sự hiện diện của VPS."
1852,2021-01-06 09:04:00,"Giải cứu thanh niên thua chứng khoán định nhảy cầu tự tử Chơi chứng khoán trên ứng dụng điện thoại, nam thanh niên 27 tuổi thua 300 triệu đồng. Trong lúc túng cùng, nam thanh niên định nhảy cầu tự tử."
1853,2021-01-05 20:31:00,"Nhà đầu tư đổ xô mở tài khoản chứng khoán trong tháng cuối năm 2020, xác lập kỷ lục chưa từng có Trong tháng 12, nhà đầu tư trong nước đã mở mới 63.243 tài khoản chứng khoán, tăng 53% so với tháng trước đó và cũng là con số kỷ lục từ trước tới nay."
1854,2021-01-05 12:30:00,"Dự báo chứng khoán sẽ đạt đỉnh trong quý I/2021, Cựu Chủ tịch LienViet PostBank khuyên nhà đầu tư bán ngay cổ phiếu ngân hàng, đổ tiền vào 3 phân khúc BĐS mới Với nhiều năm kinh nghiệm đầu tư cả chứng khoán và bất động sản, ông Nguyễn Đức Hưởng đưa ra cảnh báo cũng như lời khuyên cho các nhà đầu tư trong năm mới."
1855,2021-01-04 10:15:00,"CNBC: Chứng khoán và Bitcoin là những quả bong bóng khổng lồ CNBC dẫn lời David Rosenberg, một chuyên gia nhiều năm thường đưa ra những nhận định tiêu cực về thị trường, cảnh báo các nhà đầu tư về bong bóng từ thị trường chứng khoán và Bitcoin."
1856,2021-01-04 08:16:00,"10 năm qua, tài sản những người giàu nhất sàn chứng khoán đã thay đổi như thế nào? Năm 2010, tổng tài sản 10 người giàu nhất sàn chứng khoán chỉ là 75 nghìn tỷ đồng, thì đến năm 2020, con số này đã tăng 5 lần, lên 380 nghìn tỷ đồng."
1857,2021-01-01 20:02:00,"Kinh tế năm qua: Cơn sốt đầu tư vào Việt Nam, kỳ lân thứ 2 và lượng tiền khổng lồ làm ""tắc đường"" sàn chứng khoán Covid-19 gây ra nhiều khó khăn nhưng đồng thời lại là động lực tạo cơ hội cho Việt Nam tỏa sáng trên trường quốc tế."
1858,2020-12-31 16:49:00,"Thập kỷ bùng nổ của chứng khoán Việt Nam: Thu hút hàng tỷ đô vốn ngoại, VN-Index lập đỉnh cao mới, vốn hóa thị trường đạt hơn 5 triệu tỷ đồng Chứng khoán Việt Nam vừa khép lại thập kỷ 2011 – 2020 đầy biến động. Dù gặp không ít khó khăn từ chủ quan cũng như khách quan nhưng TTCK Việt Nam vẫn ghi nhận nhiều thành tích nổi bật trong thập kỷ qua, có thể kể tới như xác lập đỉnh cao mới 1.204 điểm, thu hút hàng tỷ USD vốn ngoại hay gia tăng vị thế trên các bảng phân loại quốc tế…"
1859,2020-12-31 16:02:00,"10 người giàu nhất sàn chứng khoán 2020: Tỷ phú Phạm Nhật Vượng vẫn đứng đầu, ông Trần Đình Long, Nguyễn Văn Đạt thăng hạng mạnh mẽ Trong top 10, có 4 người tài sản giảm trong năm 2020 và 6 người tài sản tăng. Tổng cộng, tài sản của top 10 tăng thêm 34 nghìn tỷ đồng trong năm qua."
1860,2020-12-31 11:49:00,"Nhiều thị trường chứng khoán dự kiến đóng cửa sớm trong phiên giao dịch cuối cùng của năm 2020 Các thị trường như Australia, Singapore và Hồng Kông sẽ đóng cửa sớm hơn thường lệ trong phiên giao dịch 31/12/2020 vì đây là phiên cuối cùng của năm."
1861,2020-12-30 13:49:00,Những điểm mới của Luật Chứng khoán có hiệu lực từ 1/1/2021 bất kể nhà đầu tư nào cũng nên biết Ngày 1/1/2021 Luật Chứng khoán sẽ có hiệu lực với một số điểm mới như bổ sung thêm nhiều hành vi bị nghiêm cấm; công ty đại chúng chỉ được chào bán thêm cổ phiếu ra công chúng nếu có lãi…
1862,2020-12-29 11:35:00,"Chân dung thế hệ F1 sở hữu khối tài sản cả nghìn tỷ đồng của những người giàu nhất sàn chứng khoán Ở độ tuổi 24, ông Trần Vũ Minh đã chi khoảng 700 tỷ đồng để ""bắt đáy"" cổ phiếu HPG và hiện cổ phiếu này đã tăng gấp 3."
1863,2020-12-28 11:23:00,"Thủ tướng quyết định thành lập Sở Giao dịch chứng khoán Việt Nam với vốn điều lệ 3.000 tỷ đồng, đặt trụ sở tại Hà Nội Theo quyết định của Thủ tướng, HNX sẽ có nhiệm vụ tổ chức, vận hành TTCK Phái sinh, thị trường giao dịch trái phiếu và thị trường giao dịch các loại chứng khoán khác theo quy định pháp luật. Trong khi đó, HoSE sẽ có nhiệm vụ tổ chức, vận hành thị trường giao dịch cổ phiếu và thị trường giao dịch các loại chứng khoán khác theo quy định của pháp luật."
1864,2020-12-26 11:17:00,"Sau sự cố hệ thống lớn nhất lịch sử, sàn giao dịch chứng khoán Tokyo lập tức đưa kế hoạch cải tổ Việc tái tổ chức trong thời gian sắp tới của Sở giao dịch Chứng khoán Tokyo sẽ đặt ra các tiêu chuẩn khắt khe hơn cho thị trường blue chip, theo kế hoạch chi tiết vừa được công bố. Động thái này nhằm trấn an các nhà đầu tư toàn cầu và khuyến khích các doanh nghiệp phát triển."
1865,2020-12-25 11:24:00,"Được chấp thuận thành công ty đại chúng, ""ông trùm"" phân phối Canon tại Việt Nam sắp lên sàn chứng khoán?? Những ai yêu thích bộ môn nhiếp ảnh hoặc cụ thể hơn là fan của thương hiệu máy ảnh Canon tại Việt Nam có lẽ đều biết đến cái tên Lê Bảo Minh - đơn vị phân phối số một của nhà sản xuất Nhật Bản."
1866,2020-12-22 21:25:00,"2020 - Năm tồi tệ đối với loài người nhưng lại là năm đại thắng đối với các nhà đầu tư chứng khoán? Xuyên suốt năm 2020 là thái độ phớt lờ mọi sự hỗn loạn, thậm chí nhìn vào diễn biến của thị trường còn cảm giác như nhà đầu tư đang hân hoan chào đón 1 tương lai tuyệt vời."
1867,2020-12-20 13:09:00,"Tổng thống Trump thông qua dự luật “đuổi” doanh nghiệp Trung Quốc khỏi sàn chứng khoán Mỹ Các biện pháp mới có thể coi như một trong những ""mũi dùi"" cuối cùng nhắm đến Bắc Kinh trước khi Tổng thống Trump rời khỏi nhiệm sở vào tháng 1/2021."
1868,2020-12-20 11:35:00,"Pyn Elite Fund: ""Lãi suất giảm sâu kéo nhà đầu tư vào chứng khoán, VN-Index sẽ sớm cán mốc 1.800 điểm"" Pyn Elite Fund tin rằng TTCK Việt Nam có thể gây bất ngờ lớn cho giới đầu tư với ""big year"" trong khoảng thời gian từ 2020 – 2024."
1869,2020-12-20 10:14:00,"Đội ngũ lãnh đạo toàn sếp ngân hàng, chứng khoán, công nghệ đứng sau “Vũ trụ điện ảnh Galaxy” thu về cả nghìn tỷ mỗi năm với hàng loạt bộ phim đình đám Galaxy ME bắt đầu hoạt động từ năm 1994 đến nay trở thành một thế lực trong ngành truyền thông - giải trí tại Việt Nam. Công ty này được hậu thuẫn bởi một đội ngũ số má trong lĩnh vực tài chính, lãnh đạo cấp cao tại nhiều ngân hàng, công ty chứng khoán và quỹ đầu tư."
1870,2020-12-16 15:46:00,"Chứng khoán Vietcombank: Miễn phí chuyển khoản dần trở thành xu hướng của nhóm ngân hàng cổ phần năng động Công ty chứng khoán Vietcombank (VCBS) vừa có báo cáo ngành ngân hàng năm 2021. Theo đó, việc miễn phí giao dịch kết hợp với các hình thức tăng trải nghiệm khách hàng khác có thể giúp các ngân hàng thu hút khách hàng thường xuyên, qua đó giảm chi phí vốn và tăng tín dụng."
1871,2020-12-15 14:53:00,"Chứng khoán SSI vay tín chấp 85 triệu USD từ 9 ngân hàng nước ngoài Ngày 15/12/2020, CTCP Chứng khoán SSI đã ký hợp đồng vay hợp vốn tín chấp trị giá 85 triệu USD – tương đương gần 2.000 tỷ đồng với nhóm 9 ngân hàng nước ngoài, đứng đầu là Ngân hàng Union Bank of Taiwan (UBOT)."
1872,2020-12-15 14:26:00,"Chơi chứng khoán kiểu 'ăn non', kiếm đủ tiền đóng học cho con mỗi tháng Với mục tiêu mỗi tháng kiếm thêm được vài triệu tiền học thêm cho con nên tôi thường lướt sóng chứng khoán kiểu 'cò con', 'ăn non', đầu tư thận trọng, cứ có lãi ít cũng bán luôn"
1873,2020-12-15 11:36:00,"Vietcombank vượt qua Vingroup trở thành doanh nghiệp vốn hóa lớn nhất trên sàn chứng khoán Vốn hóa Vietcombank đã tăng lên 370 nghìn tỷ đồng, vượt qua Vingroup là 368 nghìn tỷ đồng."
1874,2020-12-15 09:57:00,"Lãi suất giảm, vốn chảy vào chứng khoán? Năm 2020, Ngân hàng Nhà nước (NHNN) đã nhiều lần điều chỉnh lãi suất. Dù lãi suất xuống thấp nhưng nguồn tiền nhàn rỗi gửi tiết kiệm vẫn tiếp tục tăng và nhiều dấu hiệu cho thấy đang chảy vào chứng khoán, bất động sản."
1875,2020-12-11 15:03:00,Chứng khoán Bản Việt: Lợi nhuận Vincom Retail có thể hồi phục mạnh năm 2021 Công ty chứng khoán Bản Việt vừa có báo cáo đánh giá hoạt động kinh doanh của Công ty cổ phần Vincom Retail. Bản Việt cho rằng Vincom Retail có khả năng lãi tới 3.000 tỷ đồng năm 2021.
1876,2020-12-10 21:05:00,"Nhóm lãnh đạo chủ chốt của Hyundai Thành Công thâu tóm Chứng khoán HVS Thành công với lĩnh vực cốt lõi, Thành Công Group đang dần mở rộng hoạt động sang mảng bất động sản và tài chính. Riêng mảng tài chính, nhiều nguồn tin cho biết Thành Công Group và các bên liên quan đã nắm giữ một lượng cổ phần lớn tại Eximbank. Và hôm nay, mua lại Chứng khoán HVS sẽ mở rộng lĩnh vực tài chính của Thành Công Group."
1877,2020-12-10 14:01:00,Ngân hàng ở đâu trên “bản đồ” chứng khoán Việt? Nhóm cổ phiếu ngân hàng đã chiếm gần 29% vốn hóa toàn thị trường tính đến cuối tháng 11/2020...
1878,2020-12-09 15:47:00,"Tập đoàn Đức sắp hoàn tất thâu tóm 100% công ty dược lớn thứ hai trên sàn chứng khoán Việt Nam Về PME, Công ty có tiền thân là Công ty Dược và Vật tư y tế Phú Yên, được thành lập vào ngày 23/7/1989. Trải qua 30 năm, từ một công ty dược địa phương chuyên phân phối vật tư, trang thiết bị y tế nhỏ lẻ, PME hiện là một trong những nhà sản xuất dược phẩm hàng đầu Việt Nam và khu vực với hệ thống nhà máy sản xuất dược phẩm đạt tiêu chuẩn EU-GMP."
1879,2020-12-08 20:46:00,Goldman Sachs sắp kiểm soát hoàn toàn liên doanh chứng khoán ở Trung Quốc Goldman Sachs sắp kiểm soát hoàn toàn liên doanh chứng khoán ở Trung Quốc
1880,2020-12-07 17:18:00,"Cơn sốt nhà đầu tư F0 và ""bữa tiệc"" chứng khoán bao giờ kết thúc? ""Bữa tiệc"" chứng khoán bắt nguồn từ lãi suất thấp, nhà đầu tư F0 và dòng tiền nóng trong những ngày dịch bệnh. Khi ""món ngon"" còn nhiều, không mấy ai nghĩ tới chuyện ""rửa bát""..."
1881,2020-12-07 16:01:00,"Nhận lô vắc xin khủng từ Trung Quốc, chứng khoán quốc gia Đông Nam Á này tăng mạnh nhất châu lục 1,2 triệu liều vắc xin từ Công ty công nghệ sinh học Sinovac của Trung Quốc đã tới Indonesia vào tối muộn 6/12, tạo ra sự hứng khởi lớn cho thị trường tài chính."
1882,2020-12-03 22:00:00,"Một đại gia sở hữu 7.200 tỷ trên sàn chứng khoán Việt khuyên nhân viên ""Hãy đồng ý với mọi lời đề nghị, việc càng khó càng nên nhận"". Tại sao bạn cũng nên nghe theo lời khuyên này? Những người thành công đều hiểu rõ một điều: Nếu bạn muốn đạt được một mục tiêu lớn, bạn phải chấp nhận những thách thức."
1883,2020-12-03 14:21:00,"Hạ viện Mỹ thông qua luật chặn các công ty Trung Quốc trên sàn chứng khoán Mỹ Các công ty Trung Quốc, bao gồm cả những gã khổng lồ như Alibaba Group Holding Ltd. và Baidu Inc., đều có thể bị loại khỏi sàn giao dịch chứng khoán của Mỹ nếu không công bố thông tin kiểm toán tài chính."
1884,2020-12-03 11:25:00,"Chứng khoán Bản Việt: Tăng trưởng cho vay và huy động của BIDV kém tích cực Công ty chứng khoán Bản Việt (VCSC) vừa có báo cáo cập nhật kết quả kinh doanh 9 tháng của BIDV. Bản Việt cho biết, tăng trưởng cho vay và huy động của BIDV đều đang thấp hơn đáng kể so với kế hoạch 2020."
1885,2020-12-02 14:00:00,"Cựu chủ tịch ĐH Đông Đô - Hùng 'Sara' hốt bạc trên sàn chứng khoán như thế nào? Sau khi thành lập Sara Group cùng một loạt công ty thành viên, Trần Khắc Hùng (Hùng “Sara”), cựu chủ tịch HĐQT Đại học Đông Đô, tìm cách để cổ phiếu của các công ty được niêm yết trên thị trường chứng khoán."
1886,2020-11-28 10:31:00,"Chuyên gia tài chính cá nhân Lâm Minh Chánh: Bạn nên đầu tư dài hạn vào ngân hàng, chứng chỉ quỹ, chứng khoán tốt... và không nên đụng đến Forex! Muốn thảnh thơi tận hưởng cuộc sống khi về hưu, ngay từ bây giờ chúng ta phải vạch ra một kế hoạch đầu tư tài chính cụ thể. Nguyên tắc là đầu tư càng sớm càng tốt và ‘không bỏ trứng vào một giỏ’, nên đầu tư dàn trải vào nhiều công cụ đầu tư phòng thủ như ngân hàng, vàng, chứng khoán tốt...một cách dài hạn."
1887,2020-11-23 15:39:00,"Tỷ phú Trần Đình Long trở thành người giàu thứ 2 thị trường chứng khoán Việt Nam, vượt qua CEO Vietjet Nguyễn Thị Phương Thảo Cổ phiếu Hòa Phát tăng giá phi mã thời gian gần đây đã đưa ông Trần Đình Long trở thành người giàu thứ 2 thị trường chứng khoán Việt Nam và là người giàu thứ 3 trên bảng xếp hạng của tạp chí Forbes."
1888,2020-11-09 12:21:00,"Người giàu thứ 38 trên sàn chứng khoán muốn bán hơn 300 tỷ đồng cổ phiếu Thế Giới Di Động Ông Trần Huy Thanh Tùng là 1 trong 5 sáng lập viên của Thế Giới Di Động và đang sở hữu 17,4 triệu cổ phiếu MWG. Số cổ phiếu này có giá trị hơn 1.800 tỷ đồng và ông Tùng hiện là người giàu thứ 38 trên sàn chứng khoán."
1889,2020-11-07 09:11:00,"Mark Mobius: Nhiệm kỳ của ông Joe Biden sẽ không tốt cho chứng khoán Mỹ Sáng lập quỹ Mobius Capital Partners, ông Mark Mobius, nhận định: ""Việc ông Biden tăng thuế sẽ làm giảm động lực đầu tư vào cổ phiếu trên thị trường chứng khoán phố Wall""."
1890,2020-11-05 16:32:00,"Chứng khoán VnDirect bị phạt nặng vì cho khách hàng ""mua chịu"" cổ phiếu VnDirect hiện có thị phần thứ 4 trên cả 2 sàn HOSE và HNX, và có thị phần thứ 3 trên sàn UPCoM."
1891,2020-11-05 10:23:00,"Quỹ đầu tư hàng đầu Đông Nam Á thua lỗ sau 13 năm tham gia thị trường chứng khoán Việt Nam LionGlobal Vietnam Fund đầu tư vào Việt Nam từ 2/2/2007, đây cũng là giai đoạn VN-Index đang ở ngưỡng 1.075 điểm, khá sát vùng đỉnh 1.200 điểm được thiết lập hơn 1 tháng sau đó."
1892,2020-11-04 20:15:00,"2 kịch bản bầu cử tồi tệ quay trở lại, trở thành nỗi ám ảnh cho thị trường chứng khoán toàn cầu Bước vào cuộc bầu cử Tổng thống Mỹ, có 2 kết quả tiềm năng đang khiến nhà đầu tư lo ngại: một cuộc bầu cử với kết quả gây tranh cãi, hoặc ông Joe Biden đắc cử với quyền kiểm soát Thượng viện của đảng Cộng hòa. Giờ đây, những điều này có thể sẽ xảy ra chỉ trong 24 giờ tới."
1893,2020-11-02 09:47:00,Chứng khoán Việt có số lần giảm nhiều nhất vào tháng 11 - lịch sử có lặp lại? Cả VN-Index và HNX-Index đều có số lần giảm điểm nhiều nhất vào tháng 11 trong vòng 15 năm qua.
1894,2020-10-31 10:26:00,Singapore “soán ngôi” thị trường chứng khoán tệ nhất châu Á của Thái Lan Singapore đã vượt qua Thái Lan để trở thành thị trường chứng khoán tệ nhất ở khu vực châu Á từ đầu năm đến nay...
1895,2020-10-28 14:27:00,Airbnb dự định IPO tại sàn chứng khoán Nasdaq Công ty khởi nghiệp về dịch vụ cho thuê phòng Airbnb dự kiến sẽ thu về khoản vốn kêu gọi đầu tư lên tới 3 tỷ USD trong thương vụ IPO.
1896,2020-10-26 08:09:00,"Vì sao sàn chứng khoán Philippines 'vắng như chùa Bà Đanh' Kể từ khi ông Rodrigo Duterte nhậm chức tổng thống vào năm 2016, Philippines mới chỉ có 15 doanh nghiệp thực hiện IPO. Vì vậy, dù là một trong những sở giao dịch chứng khoán lâu đời nhất châu Á, PSE lại có danh sách niêm yết thuộc hàng ngắn nhất khu vực."
1897,2020-10-20 11:32:00,Chính phủ đặt mục tiêu đưa 3-5 ngân hàng Việt lên sàn chứng khoán nước ngoài Chính phủ cũng nêu mục tiêu có ít nhất 2-3 ngân hàng thương mại thuộc tốp 100 ngân hàng lớn nhất về tổng tài sản trong khu vực châu Á.
1898,2020-10-20 07:03:00,"Chủ nhân bí ẩn của 60 cửa hàng Fresh Garden: Dân chứng khoán rẽ ngang vì mê bánh, 10 năm chưa chi một đồng cho Marketing 10 năm kinh doanh lĩnh vực bánh tươi, chủ nhân của chuỗi Fresh Garden vẫn còn là ẩn số với ngay cả các đối thủ trong ngành. Nhiều lần từ chối báo chí, hôm nay, bà chủ của Fresh Garden quyết định bộc bạch về việc kinh doanh của bản thân - câu chuyện về người đứng sau 60 cửa hàng Fresh Garden không phải ông lớn nước ngoài nào cả, mà chỉ là một người phụ nữ làm chứng khoán Nhà nước rẽ ngang vì mê bánh…"
1899,2020-10-19 14:17:00,"Nikkei: Giới trẻ Hàn ngày càng lười, thích giàu nhanh nhờ chứng khoán ""Liệu tôi có muốn trở thành tổng giám đốc không ư? Nói thật tôi chẳng muốn phí cuộc đời cho một trò chơi đấu đá toàn những lão già"", một nhà quản lý 37 tuổi cho một công ty lớn ở Hàn Quốc giấu tên nói."
1900,2020-10-19 13:31:00,"Đầu tư tài chính cá nhân: Hãy cân nhắc cẩn thận kênh đầu tư chứng khoán quốc tế, bởi tất cả đều đang hoạt động ‘chui’ Hiện tại, Nhà nước vẫn chưa cấp phép để các sàn giao dịch quốc tế hoạt động tại Việt Nam, nên nếu ai đó chào mời bạn đầu tư vào cổ phiếu Coca Cola hay Apple đó là bất hợp pháp."
1901,2020-10-14 10:47:00,"Chứng khoán Mỹ bắt đầu xoay chuyển, nhà đầu tư đặt cược lớn cho khả năng Joe Biden đắc cử Tổng thống Trong tháng này, nhà đầu tư đã chuyển hướng sang các cổ phiếu giá trị và dần tránh đổ tiền vào những công ty tăng trưởng vốn dẫn dắt đà tăng của thị trường trong năm nay. Các mã vốn hóa nhỏ - có diễn biến kém hơn cổ phiếu vốn hóa lớn trong đợt tăng giá kể từ tháng 3, đã dần vượt trội hơn."
1902,2020-10-12 19:17:00,"Lãi suất liên tục giảm sâu, một phần dòng tiền gửi dân cư đang chuyển sang chứng khoán? BVSC cho rằng, lãi suất huy động hạ có thể là nguyên nhân khiến tiền gửi từ khu vực dân cư tăng chậm lại, có khả năng một phần dòng tiền gửi từ dân cư đã chuyển sang các kênh đầu tư khác, trong đó có chứng khoán."
1903,2020-10-08 15:13:00,"Trò chơi đình đám nhất mùa dịch đã đưa người dùng từ mua bán củ cải sang đầu tư chứng khoán như thế nào? Investopedia và công ty tư vấn Betterment đã sử dụng Animal Crossing để giải thích về các khái niệm cơ bản và nâng cao về thị trường, chẳng hạn như cung và cầu, chênh lệch giá, cũng như cách thực hiện phân tích cơ bản và kỹ thuật đối với cổ phiếu thực."
1904,2020-10-05 11:39:00,"Một linh kiện phần cứng đã hạ gục cả thị trường chứng khoán 6.000 tỷ USD như thế nào? Chỉ vì một ổ đĩa bị hỏng, cả sàn giao dịch chứng khoán và hàng hóa lớn thứ ba thế giới với trị giá 6.000 tỷ USD cuối cùng đã bị dừng hoạt động trong toàn bộ ngày hôm đó."
1905,2020-10-05 09:10:00,"Các doanh nghiệp sản xuất điện mặt trời trên sàn chứng khoán Thị trường năng lượng sạch Việt Nam đã dần hình thành với những cái tên lớn như BIM Group, Trung Nam Group, Xuân Thiện."
1906,2020-10-03 20:00:00,"Gặp sự cố lớn chưa từng có, thị trường chứng khoán 6 nghìn tỷ USD náo loạn chỉ vì 1 sàn giao dịch như thế nào? Thời điểm xảy ra sự cố là chưa đầy 1 giờ trước khi hệ thống Arrowhead bắt đầu xử lý các lệnh giao dịch trị giá 6 nghìn tỷ USD. Trong khi đó, các quan chức lại không thể tìm ra cách giải quyết. Sàn TSX đã phải ngừng toàn bộ hoạt động vào ngày thứ Năm."
1907,2020-10-02 19:03:00,Nhiều Công ty chứng khoán gặp sự cố kết nối giao dịch trong phiên 2/10 khi thanh khoản thị trường lên hơn 10.000 tỷ Sự cố mất kết nối trên diện rộng tại nhiều CTCK diễn ra trong bối cảnh thị trường biến động mạnh sau thông tin Tổng thống Mỹ D.Trump dương tính Covid-19 được truyền thông đăng tải vào buổi trưa 2/10.
1908,2020-10-02 11:38:00,"Sau khi dừng sản xuất diêm truyền thống, Diêm Thống Nhất sắp rời sàn chứng khoán Cổ phiếu của Diêm Thống Nhất hiện có mức giá 74.000 đồng/cổ phiếu, tương ứng giá trị doanh nghiệp 162,8 tỷ đồng. Những năm gần đây, doanh thu Diêm Thống Nhất liên tục tăng trưởng tốt."
1909,2020-10-01 10:19:00,"Gặp sự cố lớn chưa từng có, sàn giao dịch chứng khoán Nhật Bản bất ngờ dừng toàn bộ hoạt động Bloomberg đưa tin, hôm 30/9, do sự cố mạng, các nhà điều hành của Sở Giao dịch Chứng khoán Tokyo (TSX) đã phải tạm ngừng toàn bộ giao dịch, đóng băng hoạt động mua bán hàng nghìn cổ phiếu trong ngày đầu tiên của quý mới. Sự việc diễn ra ngay khi nước này vừa công bố số liệu kinh tế quan trọng."
1910,2020-09-29 14:34:00,"Weibo rút khỏi sàn chứng khoán Mỹ Trong bối cảnh căng thẳng Mỹ - Trung, Sina, doanh nghiệp sở hữu mạng xã hội Weibo, cùng nhiều công ty Trung Quốc đang “về nhà”."
1911,2020-09-28 10:25:00,"Không hiểu gì về chứng khoán, fan bất chấp vay ngân hàng, xin tiền bố mẹ mua cổ phiếu ủng hộ công ty chủ quản BTS Đội quân các A.R.M.Y tìm đủ mọi cách để mua được dù chỉ 1 cổ phiếu công ty quản lý BTS để có thể gặp thần tượng trong đại hội đồng cổ đông."
1912,2020-09-27 07:01:00,"Tránh sự suy giảm từ thị trường chứng khoán, giới nhà giàu chuyển hướng đầu tư vào... đồng hồ Nhiều người đang xem việc mua đồng hồ xa xỉ như một cách để đầu tư sinh lời, tương tự bất động sản, vàng, hay đơn giản là tránh sự suy giảm từ thị trường chứng khoán."
1913,2020-09-24 19:00:00,"Nhà đầu tư cá nhân giúp giá trị công ty chứng khoán Trung Quốc ‘tăng điên cuồng’ Giá trị giao dịch trung bình hàng ngày trên thị trường chứng khoán Trung Quốc năm nay chạm 874 tỷ nhân dân tệ (129 tỷ USD), theo số liệu từ Goldman Sachs, tăng gần 60% so với trung bình 5 năm qua, do đại dịch Covid-19 thúc đẩy xu hướng giao dịch cổ phiếu trực tuyến."
1914,2020-09-23 08:42:00,"Sự tuyệt vọng của giới trẻ Hàn Quốc: Có bằng đại học danh giá, công việc tốt nhưng không thể mua nhà, đầu cơ chứng khoán là cách duy nhất 'thoát nghèo' Jenny Lee - cô gái 27 tuổi vừa tìm được việc làm sau 1 năm thất nghiệp, chia sẻ: ""Tại Hàn Quốc, chúng tôi chỉ có 2 cách để làm giàu, một là trúng xổ số, hai là đầu tư cổ phiếu."""
